Handle,Title,Product Count,Parent Collection,Product Types,Product Type Counts
little-equine-co,"Little Equine Co",211,,"Bell Boots; Lead Rope; Riding Boots; Halter; t-shirt; jumper; (No Product Type); Casual Jacket; Competition Jacket; Ladies Shirt; Tall Boots; Belt; T-Shirt; Polo Shirt; Vest; Saddle Pad; Socks; Cap; Head Band; Beanie; beanie; Horse Rug; Jumper; Ladies Top; breeches; Ear Net; breastplate; Kids Jacket; Men's; Belts; Hats; Bridles; Reins; Horse Grooming; Therapy Boots; Fly Mask; Breeches; Gift Card; Tack Cleaning; Wrap Bag; Rug Rack; Stable Accessories; Half Chaps; long socks; Riding Pants; Bandages; Bandage Pads; Fly Bonnet; Exercise Boots; Saddle Pads & Blankets; Fly Hood; Riding Jacket; Shirt","Bell Boots: 1; Lead Rope: 2; Riding Boots: 9; Halter: 3; t-shirt: 4; jumper: 3; (No Product Type): 1; Casual Jacket: 10; Competition Jacket: 7; Ladies Shirt: 8; Tall Boots: 8; Belt: 7; T-Shirt: 2; Polo Shirt: 1; Vest: 3; Saddle Pad: 16; Socks: 6; Cap: 3; Head Band: 1; Beanie: 2; beanie: 3; Horse Rug: 13; Jumper: 1; Ladies Top: 2; breeches: 1; Ear Net: 11; breastplate: 6; Kids Jacket: 1; Men's: 2; Belts: 4; Hats: 2; Bridles: 11; Reins: 10; Horse Grooming: 4; Therapy Boots: 3; Fly Mask: 1; Breeches: 13; Gift Card: 1; Tack Cleaning: 1; Wrap Bag: 1; Rug Rack: 1; Stable Accessories: 1; Half Chaps: 1; long socks: 7; Riding Pants: 1; Bandages: 2; Bandage Pads: 1; Fly Bonnet: 1; Exercise Boots: 2; Saddle Pads & Blankets: 2; Fly Hood: 1; Riding Jacket: 2; Shirt: 1"
horse-bits,"Shop & Buy Horse Bits - Quality Brands - All Types",208,,"Bits; Bits - Bit Accessories; HORSE: Bits; HORSE: Reins; Reins; Spurs & Straps; Strapping - Bridles - Bridle Accessories","Bits: 124; Bits - Bit Accessories: 3; HORSE: Bits: 77; HORSE: Reins: 1; Reins: 1; Spurs & Straps: 1; Strapping - Bridles - Bridle Accessories: 1"
ariat,"Shop & Buy Ariat Clothing & Footwear",202,,"Clothing - Ladies Clothing; Accessories - Luggage; CLOTHING: Hats & Caps; Clothing - Kid's Clothing; Boots; FOOTWEAR: Western & Roper Boots; FOOTWEAR CLEARANCE; RIDER: Spurs & Straps; FOOTWEAR: Casual Footwear; Clothing - Clothing Accessories; Boots - Boot Accessories; CLOTHING: Clothing Mens; CLOTHING: Clothing Ladies; Womens; Womens Footwear; Caps; Kids; Mens Footwear; Accessories; Womens Jeans; Mens; Wallets & Handbags; Mens Jeans; Gear Bag; RIDER: Luggage; FOOTWEAR: Equestrian Footwear; CLOTHING: Socks; CLOTHING: Jeans; RIDER: Chapettes & Gaiters; RIDER: Hats & Caps; Ladies Clothing; Clothing","Clothing - Ladies Clothing: 15; Accessories - Luggage: 1; CLOTHING: Hats & Caps: 3; Clothing - Kid's Clothing: 3; Boots: 16; FOOTWEAR: Western & Roper Boots: 7; FOOTWEAR CLEARANCE: 1; RIDER: Spurs & Straps: 37; FOOTWEAR: Casual Footwear: 4; Clothing - Clothing Accessories: 4; Boots - Boot Accessories: 1; CLOTHING: Clothing Mens: 1; CLOTHING: Clothing Ladies: 3; Womens: 20; Womens Footwear: 9; Caps: 2; Kids: 12; Mens Footwear: 12; Accessories: 2; Womens Jeans: 1; Mens: 6; Wallets & Handbags: 1; Mens Jeans: 1; Gear Bag: 1; RIDER: Luggage: 24; FOOTWEAR: Equestrian Footwear: 9; CLOTHING: Socks: 1; CLOTHING: Jeans: 1; RIDER: Chapettes & Gaiters: 1; RIDER: Hats & Caps: 1; Ladies Clothing: 1; Clothing: 1"
footwear,"Horse Riding Boots & Footwear, Trainers, Workers",194,,"Boots; Spurs & Straps; FOOTWEAR: Western & Roper Boots; FOOTWEAR CLEARANCE; RIDER: Spurs & Straps; FOOTWEAR: Casual Footwear; Riding Boots; Spurs & Straps - Spurs Accessories; Clothing - Ladies Clothing; Boots - Boot Accessories; (No Product Type); Leather Care; Saddles - Saddle Accessories; RIDER: Luggage; FOOTWEAR: Equestrian Footwear; CLOTHING: Socks; CLOTHING: Jeans; RIDER: Chapettes & Gaiters; Tall Boots; Spurs; Key Chain Clip; Clothing - Clothing Accessories","Boots: 53; Spurs & Straps: 44; FOOTWEAR: Western & Roper Boots: 13; FOOTWEAR CLEARANCE: 1; RIDER: Spurs & Straps: 25; FOOTWEAR: Casual Footwear: 8; Riding Boots: 9; Spurs & Straps - Spurs Accessories: 1; Clothing - Ladies Clothing: 1; Boots - Boot Accessories: 2; (No Product Type): 6; Leather Care: 1; Saddles - Saddle Accessories: 1; RIDER: Luggage: 1; FOOTWEAR: Equestrian Footwear: 10; CLOTHING: Socks: 1; CLOTHING: Jeans: 1; RIDER: Chapettes & Gaiters: 1; Tall Boots: 4; Spurs: 9; Key Chain Clip: 1; Clothing - Clothing Accessories: 1"
breeches,"Horse Riding Breeches - Quality International & National Brands",187,,"Breeches; Jodhpurs; Clothing - Kid's Clothing; Clothing - Ladies Clothing; breeches; Breeches & Riding Tights; Clothing - Men's Clothing; Ladies Breeches; CLOTHING: Jodhpurs & Breeches Ladies; Riding Pants; (No Product Type); Jeans; Girls Breeches; Mens Breeches; Ladies Clothing; Clothing","Breeches: 52; Jodhpurs: 9; Clothing - Kid's Clothing: 9; Clothing - Ladies Clothing: 63; breeches: 3; Breeches & Riding Tights: 9; Clothing - Men's Clothing: 11; Ladies Breeches: 11; CLOTHING: Jodhpurs & Breeches Ladies: 1; Riding Pants: 2; (No Product Type): 1; Jeans: 2; Girls Breeches: 3; Mens Breeches: 1; Ladies Clothing: 1; Clothing: 9"
horse-boots,"Horse Boots - All Types",183,,"HORSE: Horse Boots; Horse Boots & Bandages; Therapy Boots; Exercise Boots; Horse Boots; (No Product Type); Accessories; Boots; Hoof Care; Socks; Overreach Boots; Horse Boots & Leg Wraps; Tendon Boots; ICE BOOTS; Travel Boots; Fetlock boots; Clothing - Men's Clothing; Clothing - Kid's Clothing; Clothing - Ladies Clothing; STABLE: Ice Boots; HORSE: Flyveils & Bonnets; Bell Boots; Horse Rugs","HORSE: Horse Boots: 51; Horse Boots & Bandages: 4; Therapy Boots: 4; Exercise Boots: 2; Horse Boots: 86; (No Product Type): 3; Accessories: 1; Boots: 1; Hoof Care: 1; Socks: 1; Overreach Boots: 3; Horse Boots & Leg Wraps: 1; Tendon Boots: 2; ICE BOOTS: 1; Travel Boots: 1; Fetlock boots: 1; Clothing - Men's Clothing: 1; Clothing - Kid's Clothing: 1; Clothing - Ladies Clothing: 1; STABLE: Ice Boots: 9; HORSE: Flyveils & Bonnets: 1; Bell Boots: 6; Horse Rugs: 1"
zilco,"Shop Zilco Rugs, Horse Boots & Accessories",180,,"Horse Rugs; Racing; SADDLES: All Purpose Saddles; Horse Boots; RUGS: Rug Accessories; HORSE: Stock & Western; STABLE: Ice Boots; HORSE: Girths; Default; Rain Rugs; Bits; Stirrup Irons; Grooming Products; Saddle Accessories; Chaps; Stable; Helmets; Winter Rugs; Gloves; Lead Ropes; Stock & Western Pads; Accessories; Ear Bonnet; Gear Bag; Mesh Rug; RUGS: Winter Rugs, Neck Rugs & Hoods; HORSE: Saddlecloths; HORSE: Racing & PVC; RUGS: Summer Rugs, Neck Rugs & Hoods; HORSE: Headstalls; HORSE: Leads & Snap Hooks; HORSE: Bits; HORSE: Lungeing & Schooling; HORSE: Stirrup Leathers; RIDER: Spurs & Straps; SADDLES: Saddle Accessories & Gullets; HORSE: Bridles; HORSE: Horse Boots; HORSE: Wither & Back Pads; RIDER: Luggage; RIDER: Glasses & Goggles; HORSE: Breastplates & Martingales; Strapping - Girths; Gifts; Strapping - Halters; Strapping; Strapping - Martingales; Saddle Cloths; Rugs","Horse Rugs: 12; Racing: 8; SADDLES: All Purpose Saddles: 1; Horse Boots: 7; RUGS: Rug Accessories: 5; HORSE: Stock & Western: 6; STABLE: Ice Boots: 2; HORSE: Girths: 1; Default: 1; Rain Rugs: 1; Bits: 4; Stirrup Irons: 2; Grooming Products: 4; Saddle Accessories: 1; Chaps: 1; Stable: 1; Helmets: 5; Winter Rugs: 1; Gloves: 1; Lead Ropes: 1; Stock & Western Pads: 2; Accessories: 1; Ear Bonnet: 1; Gear Bag: 1; Mesh Rug: 1; RUGS: Winter Rugs, Neck Rugs & Hoods: 7; HORSE: Saddlecloths: 16; HORSE: Racing & PVC: 21; RUGS: Summer Rugs, Neck Rugs & Hoods: 6; HORSE: Headstalls: 9; HORSE: Leads & Snap Hooks: 10; HORSE: Bits: 4; HORSE: Lungeing & Schooling: 2; HORSE: Stirrup Leathers: 1; RIDER: Spurs & Straps: 3; SADDLES: Saddle Accessories & Gullets: 1; HORSE: Bridles: 1; HORSE: Horse Boots: 1; HORSE: Wither & Back Pads: 1; RIDER: Luggage: 1; RIDER: Glasses & Goggles: 13; HORSE: Breastplates & Martingales: 1; Strapping - Girths: 1; Gifts: 1; Strapping - Halters: 3; Strapping: 1; Strapping - Martingales: 1; Saddle Cloths: 1; Rugs: 3"
kentucky,"Shop Kentucky Horsewear - Boots, Pads, Bonnets, Girths, Bandages & More",165,,"Strapping - Strapping Accessories; Horse Rugs; Horse Rugs - Rug Accessories; Horse Boots; Strapping - Girths; Clothing - Clothing Accessories; Saddle Cloths; Saddle Pad; saddle pad; Stable Accessories; Accessories; Saddles - Saddle Accessories; Strapping - Halters; Fly Control; Accessories - Luggage; Fly Mask; Fly Veil; Halter; Horse Halters; Halter Set; Socks; Therapy Boots; Overreach Boots; Tendon Boots; ICE BOOTS; Clothing Accessories; Strapping - Bridles - Bridle Accessories; Rug","Strapping - Strapping Accessories: 3; Horse Rugs: 12; Horse Rugs - Rug Accessories: 6; Horse Boots: 63; Strapping - Girths: 4; Clothing - Clothing Accessories: 3; Saddle Cloths: 30; Saddle Pad: 1; saddle pad: 1; Stable Accessories: 1; Accessories: 12; Saddles - Saddle Accessories: 2; Strapping - Halters: 6; Fly Control: 2; Accessories - Luggage: 1; Fly Mask: 1; Fly Veil: 1; Halter: 4; Horse Halters: 1; Halter Set: 1; Socks: 1; Therapy Boots: 1; Overreach Boots: 2; Tendon Boots: 2; ICE BOOTS: 1; Clothing Accessories: 1; Strapping - Bridles - Bridle Accessories: 1; Rug: 1"
horse-rugs,"Horse Rugs - All Types",160,,"Horse Rugs; RUGS: Winter Rugs, Neck Rugs & Hoods; RUGS: Summer Rugs, Neck Rugs & Hoods; RUGS: Rug Accessories; Rug; Horse Rugs - Rug Accessories; Hood; Tailbag; Sale; HORSE RUG CLEARANCE; Fly Mask; Veterinary; Horse Rug; Therapy Boots; Rug Rack; (No Product Type); Rugs; Horse Boots","Horse Rugs: 49; RUGS: Winter Rugs, Neck Rugs & Hoods: 18; RUGS: Summer Rugs, Neck Rugs & Hoods: 33; RUGS: Rug Accessories: 11; Rug: 5; Horse Rugs - Rug Accessories: 6; Hood: 4; Tailbag: 3; Sale: 1; HORSE RUG CLEARANCE: 3; Fly Mask: 1; Veterinary: 1; Horse Rug: 11; Therapy Boots: 1; Rug Rack: 1; (No Product Type): 6; Rugs: 5; Horse Boots: 1"
eurohunter,"Shop Eurohunter Equestrian Gear & Accessories",149,,"RUGS: Winter Rugs, Neck Rugs & Hoods; RUGS: Summer Rugs, Neck Rugs & Hoods; RUGS: Rug Accessories; Girth; HORSE: Headstalls; HORSE: Lungeing & Schooling; HORSE: Saddlecloths; HORSE: Horse Boots; English Reins; Rug Accessories; Chaps; Stock & Western Reins; Grooming Bags and Brushes; Gloves; Horse Boots; Cotton Rugs; Womens Footwear; Winter Rugs; Stirrup Irons; Default; Travel; Dogs; Mesh Rug; Lead Ropes; Footwear Accessories; Halter; Bridle; Helmets; Flag Rug; Rope; SADDLES: Saddle Accessories & Gullets; FOOTWEAR: Equestrian Footwear; STABLE: First Aid & Dressings; HORSE: Leads & Snap Hooks; Veterinary; STABLE: Feed Bins & Hay Bags; RIDER: Helmets; HORSE: Stock & Western; HORSE: Girths; RIDER: Chapettes & Gaiters; HORSE: Bridles; Strapping - Girths; (No Product Type)","RUGS: Winter Rugs, Neck Rugs & Hoods: 8; RUGS: Summer Rugs, Neck Rugs & Hoods: 18; RUGS: Rug Accessories: 5; Girth: 4; HORSE: Headstalls: 2; HORSE: Lungeing & Schooling: 13; HORSE: Saddlecloths: 15; HORSE: Horse Boots: 10; English Reins: 2; Rug Accessories: 2; Chaps: 2; Stock & Western Reins: 1; Grooming Bags and Brushes: 3; Gloves: 1; Horse Boots: 3; Cotton Rugs: 3; Womens Footwear: 1; Winter Rugs: 2; Stirrup Irons: 1; Default: 1; Travel: 1; Dogs: 1; Mesh Rug: 1; Lead Ropes: 2; Footwear Accessories: 1; Halter: 2; Bridle: 1; Helmets: 1; Flag Rug: 1; Rope: 1; SADDLES: Saddle Accessories & Gullets: 1; FOOTWEAR: Equestrian Footwear: 6; STABLE: First Aid & Dressings: 5; HORSE: Leads & Snap Hooks: 4; Veterinary: 4; STABLE: Feed Bins & Hay Bags: 1; RIDER: Helmets: 3; HORSE: Stock & Western: 2; HORSE: Girths: 1; RIDER: Chapettes & Gaiters: 4; HORSE: Bridles: 6; Strapping - Girths: 2; (No Product Type): 1"
horse-jewellery,"Horse Jewellery - Equine & Equestrian Themed",141,,"Riding Apparel & Accessories; Jewellery; DIY Kit; Pendants; Bracelet; Pearl Necklace; Rings; Fob; Charm Bead; Locket; Key Chain Clip; Custom Orders; bead; Book; Earrings; Hatband; Gift Set; Necklace; Gift Certificates; tie; keyring; Bookmarks","Riding Apparel & Accessories: 5; Jewellery: 59; DIY Kit: 29; Pendants: 4; Bracelet: 14; Pearl Necklace: 5; Rings: 2; Fob: 1; Charm Bead: 2; Locket: 1; Key Chain Clip: 5; Custom Orders: 1; bead: 1; Book: 1; Earrings: 2; Hatband: 1; Gift Set: 3; Necklace: 1; Gift Certificates: 1; tie: 1; keyring: 1; Bookmarks: 1"
horse-riding-helmets,"Buy Horse Riding Helmets For Equestrians",132,,"Helmet; Helmets; Bicycle Helmet Brim Visor; Hats & Accessories; RIDER: Helmets; helmet; Helmet Brim","Helmet: 30; Helmets: 81; Bicycle Helmet Brim Visor: 1; Hats & Accessories: 1; RIDER: Helmets: 16; helmet: 2; Helmet Brim: 1"
birds,"Shop Birds - Feed, Treats, Accessories, Supplies",124,,"Bird Food & Treats; STABLE: Show Preparation; Small Animal; Feed Supplements; Bird Cages & Furniture; Dog Toys; Belts & Bracelets; Dog Kennels Carriers & Pens; Cat Gyms & Toys; Poultry; Bird Potions & Lotions; Bird Assorted; STABLE: First Aid & Dressings; STABLE: Supplements; Dog Potions & Lotions; Dog Accessories; Bird Toys","Bird Food & Treats: 16; STABLE: Show Preparation: 2; Small Animal: 5; Feed Supplements: 1; Bird Cages & Furniture: 28; Dog Toys: 2; Belts & Bracelets: 1; Dog Kennels Carriers & Pens: 1; Cat Gyms & Toys: 7; Poultry: 6; Bird Potions & Lotions: 4; Bird Assorted: 3; STABLE: First Aid & Dressings: 2; STABLE: Supplements: 2; Dog Potions & Lotions: 2; Dog Accessories: 5; Bird Toys: 37"
vivarchie-equestrian,"Vivarchie Equestrian",118,,"(No Product Type); Accessories; Boots","(No Product Type): 116; Accessories: 1; Boots: 1"
horse-halters,"Shop Horse Halters",113,,"(No Product Type); Strapping - Halters; HORSE: Number Holders; HORSE: Headstalls; Jewellery; Halter; Halters; Lead Rope; lead rope; halter; Racing; HORSE: Racing & PVC; HORSE: Leads & Snap Hooks; HORSE: Flyveils & Bonnets; Horse Halters; Halter Set; Strapping - Strapping Accessories; Strapping - Bridles - Bridle Accessories; Feed Supplements; Horse Rugs","(No Product Type): 4; Strapping - Halters: 27; HORSE: Number Holders: 1; HORSE: Headstalls: 56; Jewellery: 3; Halter: 7; Halters: 1; Lead Rope: 1; lead rope: 1; halter: 1; Racing: 1; HORSE: Racing & PVC: 1; HORSE: Leads & Snap Hooks: 1; HORSE: Flyveils & Bonnets: 1; Horse Halters: 1; Halter Set: 1; Strapping - Strapping Accessories: 1; Strapping - Bridles - Bridle Accessories: 1; Feed Supplements: 2; Horse Rugs: 1"
living-horse-tales-jewellery-by-monika,"Living Horse Tales Jewellery By Monika",103,,"DIY Kit; Necklace; Cuff; Fob; Other; Pendants; Locket; Hatband; Earrings; Key Chain Clip; Bracelet; Key chain ring; Charm Bead; Custom Orders; bead; Book; Gift Set; Gift Certificates; tie; keyring; Bookmarks","DIY Kit: 32; Necklace: 15; Cuff: 1; Fob: 3; Other: 2; Pendants: 2; Locket: 2; Hatband: 2; Earrings: 8; Key Chain Clip: 7; Bracelet: 16; Key chain ring: 1; Charm Bead: 2; Custom Orders: 1; bead: 1; Book: 1; Gift Set: 3; Gift Certificates: 1; tie: 1; keyring: 1; Bookmarks: 1"
stirrups,"Shop Horse Riding Stirrups & Leathers",96,,"HORSE: Stock & Western; Stirrup Irons; (No Product Type); HORSE: Stirrup Leathers; Stirrup Irons - Stirrup Accessories; Synthetic Stirrup Straps; HORSE: Stirrup Irons; Saddles - Saddle Accessories; HORSE: Racing & PVC; Stirrup Leathers; Strapping - Stirrup Leathers; Strapping","HORSE: Stock & Western: 5; Stirrup Irons: 22; (No Product Type): 1; HORSE: Stirrup Leathers: 24; Stirrup Irons - Stirrup Accessories: 4; Synthetic Stirrup Straps: 1; HORSE: Stirrup Irons: 30; Saddles - Saddle Accessories: 1; HORSE: Racing & PVC: 5; Stirrup Leathers: 1; Strapping - Stirrup Leathers: 1; Strapping: 1"
horse-bandages,"Leg Wraps & Bandages For Your Horse Or Pony",78,,"Horse Boots & Bandages; Veterinary; Horse Boots; Stable Accessories; STABLE: First Aid & Dressings; RUGS: Rug Accessories; STABLE: Leather Care & Proofing; HORSE: Horse Boots; HORSE: Bits; Bandage Pads; Ear Net","Horse Boots & Bandages: 3; Veterinary: 11; Horse Boots: 40; Stable Accessories: 1; STABLE: First Aid & Dressings: 15; RUGS: Rug Accessories: 1; STABLE: Leather Care & Proofing: 1; HORSE: Horse Boots: 3; HORSE: Bits: 1; Bandage Pads: 1; Ear Net: 1"
equipe,"Shop Equipe",69,,"Strapping - Breast Plates; Saddles; Strapping - Bridles; Strapping - Reins; Saddles - Saddle Accessories; saddles; Grooming; Clothing; Clothing - Clothing Accessories; Strapping; Strapping - Bridles - Bridle Accessories; Bridle Accessories; Strapping - Martingales; Bridles; Saddle Cloths","Strapping - Breast Plates: 6; Saddles: 15; Strapping - Bridles: 10; Strapping - Reins: 7; Saddles - Saddle Accessories: 1; saddles: 2; Grooming: 1; Clothing: 1; Clothing - Clothing Accessories: 1; Strapping: 8; Strapping - Bridles - Bridle Accessories: 3; Bridle Accessories: 2; Strapping - Martingales: 3; Bridles: 2; Saddle Cloths: 7"
ippico-equestrian,"Ippico Equestrian",69,,"Sleepwear; Riding Apparel & Accessories; Equestrian; Coat Care; Horse Grooming Combs, Brushes & Mitts; Hair Accessory; Bell Boots; Storage","Sleepwear: 2; Riding Apparel & Accessories: 11; Equestrian: 6; Coat Care: 1; Horse Grooming Combs, Brushes & Mitts: 33; Hair Accessory: 9; Bell Boots: 6; Storage: 1"
accessories,"Accessories",69,,"Clothing - Clothing Accessories; Clothing; Horse Rugs; HORSE: Stock & Western; Gloves; (No Product Type); HORSE: Girths; Small Animal; Dog Walking; Horse Boots; Clothing Accessories; Clothing - Ladies Clothing; Ladies Clothing; Clothing - Kid's Clothing; Boots; Strapping; Saddle Cloths","Clothing - Clothing Accessories: 11; Clothing: 16; Horse Rugs: 2; HORSE: Stock & Western: 4; Gloves: 9; (No Product Type): 1; HORSE: Girths: 1; Small Animal: 2; Dog Walking: 2; Horse Boots: 1; Clothing Accessories: 1; Clothing - Ladies Clothing: 8; Ladies Clothing: 2; Clothing - Kid's Clothing: 1; Boots: 2; Strapping: 2; Saddle Cloths: 4"
cavallo,"Shop Cavallo Products",67,,"Riding Boots; Halter; Saddle Pad; (No Product Type); Casual Jacket; Belt; long socks; Belts; Socks; Tall Boots; Cap; jumper; Riding Pants; Breeches; Bandages; Bandage Pads; Fly Bonnet; Exercise Boots; Ear Net; Horse Rug; Saddle Pads & Blankets; Fly Hood; Competition Jacket; t-shirt; Ladies Shirt; Shirt; Ladies Top","Riding Boots: 9; Halter: 1; Saddle Pad: 8; (No Product Type): 1; Casual Jacket: 1; Belt: 5; long socks: 5; Belts: 1; Socks: 2; Tall Boots: 4; Cap: 1; jumper: 2; Riding Pants: 1; Breeches: 3; Bandages: 2; Bandage Pads: 1; Fly Bonnet: 1; Exercise Boots: 2; Ear Net: 3; Horse Rug: 2; Saddle Pads & Blankets: 2; Fly Hood: 1; Competition Jacket: 2; t-shirt: 2; Ladies Shirt: 3; Shirt: 1; Ladies Top: 1"
jnk-collective,"JNK Collective",66,,"Ultimate Tights; Freedom Tights; Tights; Active Tights; Tank; Horseware; Shirts; Breeches; Elite Tights; Accessoriess; Cap; Outerwear; Leggings; shirts; accessoriess; Active tights","Ultimate Tights: 2; Freedom Tights: 6; Tights: 11; Active Tights: 4; Tank: 4; Horseware: 4; Shirts: 13; Breeches: 5; Elite Tights: 2; Accessoriess: 5; Cap: 1; Outerwear: 3; Leggings: 2; shirts: 2; accessoriess: 1; Active tights: 1"
bare-equestrian,"Shop BARE Equestrian Apparel & Gear",61,,"Clothing - Kid's Clothing; Clothing - Ladies Clothing; Clothing; (No Product Type); Clothing - Clothing Accessories; Ladies Clothing","Clothing - Kid's Clothing: 2; Clothing - Ladies Clothing: 21; Clothing: 26; (No Product Type): 4; Clothing - Clothing Accessories: 6; Ladies Clothing: 2"
saddles,"Saddles For All Disciplines",57,,"Saddles; SADDLES: Dressage Saddles; SADDLES: All Purpose Saddles; SADDLES: Jumping Saddles; SADDLES: Saddle Accessories & Gullets; Saddles - Saddle Accessories; saddles; Grooming","Saddles: 22; SADDLES: Dressage Saddles: 8; SADDLES: All Purpose Saddles: 8; SADDLES: Jumping Saddles: 4; SADDLES: Saddle Accessories & Gullets: 4; Saddles - Saddle Accessories: 4; saddles: 6; Grooming: 1"
qj-riding-wear,"QJ Riding Wear",56,,"belts; cap; top; Shirt; Breeches; shirt; breeches; shirts; beanies; (No Product Type); riding tights; stock; Sweater; socks; Top; jacket; Gift Card","belts: 2; cap: 2; top: 1; Shirt: 2; Breeches: 23; shirt: 4; breeches: 5; shirts: 2; beanies: 1; (No Product Type): 2; riding tights: 1; stock: 2; Sweater: 2; socks: 1; Top: 1; jacket: 4; Gift Card: 1"
horse-toys,"Shop Kids Horse Toys",54,,"RIDER: Giftware; The Trail of Painted Ponies","RIDER: Giftware: 44; The Trail of Painted Ponies: 10"
hitchley-harrow,"Hitchley & Harrow",54,,"Handbag; Pendants; Belt; (No Product Type); Resin; Bangles; Pearl Necklace; Log Book Cover; Rings","Handbag: 2; Pendants: 4; Belt: 20; (No Product Type): 11; Resin: 2; Bangles: 5; Pearl Necklace: 5; Log Book Cover: 2; Rings: 3"
thinline-global-australia,"Shop Thinline Global Australia",50,,"(No Product Type); Saddle Pad; Strapping - Reins; Saddle Cloths; Strapping - Halters; Horse Boots; Western Pads; Saddles - Saddle Accessories; Stirrup Irons - Stirrup Accessories; Strapping - Girths; Strapping - Bridles - Bridle Accessories","(No Product Type): 25; Saddle Pad: 2; Strapping - Reins: 1; Saddle Cloths: 4; Strapping - Halters: 3; Horse Boots: 2; Western Pads: 9; Saddles - Saddle Accessories: 1; Stirrup Irons - Stirrup Accessories: 1; Strapping - Girths: 1; Strapping - Bridles - Bridle Accessories: 1"
hairy-pony,"Shop Hairy Pony Grooming Products",48,,"STABLE: Grooming; STABLE: Show Preparation; grooming; plaiting kit; brush; Horse Grooming","STABLE: Grooming: 24; STABLE: Show Preparation: 16; grooming: 4; plaiting kit: 1; brush: 2; Horse Grooming: 1"
luggage,"Luggage For The Horse Rider",45,,"Accessories - Luggage; RIDER: Luggage; Luggage; Boots - Boot Accessories; HORSE: Stock & Western; Dog Walking; STABLE: Leather Care & Proofing","Accessories - Luggage: 1; RIDER: Luggage: 34; Luggage: 5; Boots - Boot Accessories: 1; HORSE: Stock & Western: 2; Dog Walking: 1; STABLE: Leather Care & Proofing: 1"
farrier-tools,"Shop Farrier Tools",42,,"STABLE: Farrier; STABLE: Supplements; Hoof Care","STABLE: Farrier: 40; STABLE: Supplements: 1; Hoof Care: 1"
plum-tack,"Plum Tack - Quality Australia Riding Apparel & Clothing",42,,"Jodhpurs; Riding Tights; Breeches; Riding Pants; Riding Apparel & Accessories; Tops","Jodhpurs: 17; Riding Tights: 1; Breeches: 10; Riding Pants: 7; Riding Apparel & Accessories: 1; Tops: 6"
stable-and-yard,"Stable & Arena Gear",41,,"(No Product Type); STABLE: Feed Bins & Hay Bags; Leather Care; STABLE: Horse Treats & Toys; Small Animal","(No Product Type): 5; STABLE: Feed Bins & Hay Bags: 21; Leather Care: 12; STABLE: Horse Treats & Toys: 2; Small Animal: 1"
the-equestrian,"The Equestrian",36,,"Horse Grooming; Accessories; Saddle Pad; (No Product Type); Shampoo; Dog Grooming & Coat Care; Jewellery; saddle pad; HORSE: Saddlecloths; Horse Boots; Bridles; Saddlepad; Wither relief saddlepad","Horse Grooming: 1; Accessories: 1; Saddle Pad: 5; (No Product Type): 11; Shampoo: 1; Dog Grooming & Coat Care: 1; Jewellery: 1; saddle pad: 4; HORSE: Saddlecloths: 1; Horse Boots: 4; Bridles: 1; Saddlepad: 4; Wither relief saddlepad: 1"
animo,"Shop Animo Equestrian Gear",35,,"Breeches; Socks; Cap; Mens Competition Jacket; Trousers; jacket; Competition Jacket; Mens Breeches; Belts; t-shirt; Show Shirt; Boys Show Shirt; Ladies Breeches; Girls Breeches; Casual Jacket","Breeches: 13; Socks: 4; Cap: 1; Mens Competition Jacket: 1; Trousers: 1; jacket: 1; Competition Jacket: 2; Mens Breeches: 1; Belts: 2; t-shirt: 1; Show Shirt: 1; Boys Show Shirt: 1; Ladies Breeches: 2; Girls Breeches: 1; Casual Jacket: 3"
dyon,"Shop Dy'On European Classic Equestrian Gear",34,,"Bridles; breastplate; Reins; Wrap Bag; Rug Rack; Stable Accessories; Socks; Horse Rug; Belts; Half Chaps","Bridles: 11; breastplate: 5; Reins: 10; Wrap Bag: 1; Rug Rack: 1; Stable Accessories: 1; Socks: 1; Horse Rug: 1; Belts: 2; Half Chaps: 1"
elt,"ELT  Equestrian",28,,"Apparel - Ladies; Gloves; Horse Boots & Bandages; Breeches & Riding Tights; Footwear & Chaps; Clothing - Ladies Clothing; Clothing; Boots","Apparel - Ladies: 10; Gloves: 2; Horse Boots & Bandages: 1; Breeches & Riding Tights: 10; Footwear & Chaps: 2; Clothing - Ladies Clothing: 1; Clothing: 1; Boots: 1"
ps-of-sweden,"PS Of Sweden",27,,"(No Product Type); Horse Boots","(No Product Type): 22; Horse Boots: 5"
fly-veils-and-hoods,"Mask & Fly Veils For Horses & Ponies",26,,"Fly Control; (No Product Type); fly bonnet; Fly Mask; Ear Net; Fly Bonnet; Fly Hood; Bridle Accessories; Strapping - Bridles - Bridle Accessories","Fly Control: 7; (No Product Type): 8; fly bonnet: 1; Fly Mask: 1; Ear Net: 4; Fly Bonnet: 1; Fly Hood: 1; Bridle Accessories: 1; Strapping - Bridles - Bridle Accessories: 2"
base-layers,"Shop Horse Riding Base Layers",25,,"Clothing - Ladies Clothing; top; Clothing - Kid's Clothing; (No Product Type); Womens; shirts; shirt; Equestrian; RUGS: Summer Rugs, Neck Rugs & Hoods; CLOTHING: Casual Clothing Childs; CLOTHING CLEARANCE; Ladies Shirt; Merchandise; long sleeve; Clothing","Clothing - Ladies Clothing: 9; top: 1; Clothing - Kid's Clothing: 1; (No Product Type): 2; Womens: 1; shirts: 2; shirt: 1; Equestrian: 1; RUGS: Summer Rugs, Neck Rugs & Hoods: 1; CLOTHING: Casual Clothing Childs: 1; CLOTHING CLEARANCE: 1; Ladies Shirt: 1; Merchandise: 1; long sleeve: 1; Clothing: 1"
ego-7,"Ego 7",24,,"Boots; Clothing - Ladies Clothing; Clothing - Clothing Accessories; Clothing","Boots: 9; Clothing - Ladies Clothing: 13; Clothing - Clothing Accessories: 1; Clothing: 1"
visentin-equestrian,"Visentin Equestrian",23,,"HORSE: Number Holders; (No Product Type)","HORSE: Number Holders: 11; (No Product Type): 12"
cavalor-equicare,"Cavalor Equicare",21,,"Horse Supplements; Care; Supplements; Merchandise","Horse Supplements: 1; Care: 7; Supplements: 11; Merchandise: 2"
acavallo,"Shop Acavallo Horse Riding Essentials",21,,"HORSE: Wither & Back Pads; Saddle Pad; saddle pads; Saddle Cloths; Gel & Comfort Pads; HORSE: Bridles; HORSE: Stirrup Irons; Saddles","HORSE: Wither & Back Pads: 9; Saddle Pad: 2; saddle pads: 1; Saddle Cloths: 2; Gel & Comfort Pads: 3; HORSE: Bridles: 1; HORSE: Stirrup Irons: 1; Saddles: 2"
gifts,"Horse & Equine Gifts",21,,"Keyring; Toys; Clothing; Clothing - Clothing Accessories; Clothing Accessories; Pet; Accessories; Wallets & Handbags","Keyring: 4; Toys: 2; Clothing: 2; Clothing - Clothing Accessories: 4; Clothing Accessories: 2; Pet: 1; Accessories: 3; Wallets & Handbags: 3"
