Handle,Title,Product Count,Parent Collection,Product Types,Product Type Counts
horse-grooming-supplies,"Horse Grooming Gear & Accessories",250,,"Accessories; Veterinary; STABLE: Show Preparation; Coat, Hoof & Grooming; (No Product Type); Fly Control; Horse Grooming Combs, Brushes & Mitts; STABLE: Grooming; STABLE: Leather Care & Proofing; Horse Grooming; Health Care; Shampoo; Storage; STABLE: Hoof Care; Care Products; Luggage; Grooming; Hoof Care; Dog Grooming & Coat Care; Small Animal; STABLE: First Aid & Dressings; STABLE: Supplements; Cat Potions & Lotions; Dog Potions & Lotions; Dog Wormer & Flea; Strapping - Halters; Care","Accessories: 1; Veterinary: 13; STABLE: Show Preparation: 51; Coat, Hoof & Grooming: 4; (No Product Type): 32; Fly Control: 1; Horse Grooming Combs, Brushes & Mitts: 27; STABLE: Grooming: 54; STABLE: Leather Care & Proofing: 7; Horse Grooming: 3; Health Care: 2; Shampoo: 1; Storage: 1; STABLE: Hoof Care: 10; Care Products: 2; Luggage: 1; Grooming: 3; Hoof Care: 2; Dog Grooming & Coat Care: 20; Small Animal: 1; STABLE: First Aid & Dressings: 3; STABLE: Supplements: 1; Cat Potions & Lotions: 1; Dog Potions & Lotions: 1; Dog Wormer & Flea: 3; Strapping - Halters: 2; Care: 3"
horse-health,"Horse Health & Nutrition",250,,"probiotics; Veterinary; Horse Supplements; Accessories; STABLE: Wormers; Fly Control; Pet Supplements; Feed Supplements; (No Product Type); HORSE: Flyveils & Bonnets; STABLE: First Aid & Dressings; STABLE: Horse Treats & Toys; STABLE: Supplements; Health Care; Fly Mask; STABLE: Hoof Care; Care; Supplements; Horse Grooming; Ear Net; fly bonnet; Fly Veil; Horse Boots; Stable Accessories; Dog Treats; HORSE: Horse Boots; STABLE: Farrier; STABLE: Stable Equipment; STABLE: Instruments; Dog Potions & Lotions","probiotics: 1; Veterinary: 57; Horse Supplements: 5; Accessories: 9; STABLE: Wormers: 6; Fly Control: 9; Pet Supplements: 2; Feed Supplements: 23; (No Product Type): 2; HORSE: Flyveils & Bonnets: 13; STABLE: First Aid & Dressings: 18; STABLE: Horse Treats & Toys: 14; STABLE: Supplements: 36; Health Care: 8; Fly Mask: 4; STABLE: Hoof Care: 7; Care: 1; Supplements: 1; Horse Grooming: 1; Ear Net: 4; fly bonnet: 1; Fly Veil: 11; Horse Boots: 2; Stable Accessories: 1; Dog Treats: 1; HORSE: Horse Boots: 2; STABLE: Farrier: 3; STABLE: Stable Equipment: 1; STABLE: Instruments: 2; Dog Potions & Lotions: 5"
saddle-pads,"Saddle Blankets, Pads & Squares",250,,"(No Product Type); Saddle Cloths; Wither relief saddlepad; Western Pads; saddle pad; Saddle Pads & Blankets; Saddles; Saddles - Saddle Accessories; Saddle Pad; Saddle cloths; Saddle Cloth; saddle pads; Saddlepad; HORSE: Saddlecloths; HORSE: Wither & Back Pads; SADDLES: All Purpose Saddles; half pad; Boots; RIDER: Chapettes & Gaiters; Horse Boots; Half Pads; Saddlepads; Shetland Pony","(No Product Type): 24; Saddle Cloths: 110; Wither relief saddlepad: 1; Western Pads: 10; saddle pad: 4; Saddle Pads & Blankets: 2; Saddles: 2; Saddles - Saddle Accessories: 2; Saddle Pad: 19; Saddle cloths: 1; Saddle Cloth: 1; saddle pads: 1; Saddlepad: 4; HORSE: Saddlecloths: 37; HORSE: Wither & Back Pads: 12; SADDLES: All Purpose Saddles: 2; half pad: 1; Boots: 1; RIDER: Chapettes & Gaiters: 1; Horse Boots: 1; Half Pads: 3; Saddlepads: 10; Shetland Pony: 1"
horse-riding-apparel,"Competition, Training & Casual - Horse Riding Clothes",250,,"Breeches; Helmet Brim; Sleepwear; belts; Clothing - Clothing Accessories; Jodhpurs; Clothing; Clothing - Ladies Clothing; top; Riding Apparel & Accessories; RIDER: Gloves; Clothing - Kid's Clothing; Ultimate Tights; Shirt; HORSE: Number Holders; CLOTHING: Hats & Caps; Jewellery; Stirrup Irons; Boots; Active Tights; shirt; breeches; shirts; beanies; Equestrian; Breeches & Riding Tights; CLOTHING: Clothing Childs; CLOTHING: Clothing Ladies; STABLE: Farrier; CLOTHING: Jodhpurs & Breeches Ladies; t-shirt; jumper; Stirrup Irons - Stirrup Accessories; Belt; (No Product Type); Gloves; Clothing - Men's Clothing; Saddle Cloths; Accessories; accessoriess; Outerwear; Active tights; cap; stock; Sweater; socks; Top; jacket; Gift Card","Breeches: 29; Helmet Brim: 1; Sleepwear: 1; belts: 2; Clothing - Clothing Accessories: 11; Jodhpurs: 5; Clothing: 12; Clothing - Ladies Clothing: 79; top: 1; Riding Apparel & Accessories: 1; RIDER: Gloves: 4; Clothing - Kid's Clothing: 8; Ultimate Tights: 2; Shirt: 2; HORSE: Number Holders: 4; CLOTHING: Hats & Caps: 2; Jewellery: 1; Stirrup Irons: 6; Boots: 3; Active Tights: 3; shirt: 4; breeches: 5; shirts: 2; beanies: 1; Equestrian: 2; Breeches & Riding Tights: 3; CLOTHING: Clothing Childs: 1; CLOTHING: Clothing Ladies: 1; STABLE: Farrier: 1; CLOTHING: Jodhpurs & Breeches Ladies: 2; t-shirt: 1; jumper: 1; Stirrup Irons - Stirrup Accessories: 1; Belt: 2; (No Product Type): 10; Gloves: 9; Clothing - Men's Clothing: 9; Saddle Cloths: 1; Accessories: 2; accessoriess: 1; Outerwear: 1; Active tights: 1; cap: 1; stock: 2; Sweater: 2; socks: 1; Top: 1; jacket: 4; Gift Card: 1"
strapping,"Bridles & Strapping - Top Brands For All Disciplines",250,,"Strapping - Reins; Strapping - Breast Plates; HORSE: Stock & Western; Stirrup Irons; HORSE: Stirrup Leathers; HORSE: Reins; HORSE: Racing & PVC; HORSE: Lungeing & Schooling; HORSE: Bridles; Strapping - Girths; Girth Loop Adjustable; Strapping - Halters; Stirrup Irons - Stirrup Accessories; Gloves; Strapping - Strapping Accessories; Strapping - Bridles - Bridle Accessories; Strapping - Bridles; Strapping - Martingales; Accessories; (No Product Type); Racing; Dog Accessories; STABLE: Grooming; HORSE: Stirrup Irons; STABLE: Stable Equipment; HORSE: Girths; HORSE: Nosebands & Browbands; HORSE: Breastplates & Martingales; Dog Collars & Leads; RIDER: Giftware; HORSE: Bits; Bridles; breastplate; Reins; Stirrup Leathers; Girths","Strapping - Reins: 3; Strapping - Breast Plates: 1; HORSE: Stock & Western: 8; Stirrup Irons: 7; HORSE: Stirrup Leathers: 3; HORSE: Reins: 18; HORSE: Racing & PVC: 28; HORSE: Lungeing & Schooling: 3; HORSE: Bridles: 19; Strapping - Girths: 29; Girth Loop Adjustable: 1; Strapping - Halters: 14; Stirrup Irons - Stirrup Accessories: 1; Gloves: 1; Strapping - Strapping Accessories: 1; Strapping - Bridles - Bridle Accessories: 1; Strapping - Bridles: 3; Strapping - Martingales: 1; Accessories: 1; (No Product Type): 1; Racing: 4; Dog Accessories: 1; STABLE: Grooming: 3; HORSE: Stirrup Irons: 28; STABLE: Stable Equipment: 1; HORSE: Girths: 3; HORSE: Nosebands & Browbands: 11; HORSE: Breastplates & Martingales: 15; Dog Collars & Leads: 5; RIDER: Giftware: 1; HORSE: Bits: 1; Bridles: 12; breastplate: 5; Reins: 10; Stirrup Leathers: 1; Girths: 5"
pets,"Pets - Products For Dogs, Cats, & Other Small Animals",250,,"Pet Supplements; Horse Supplements; Dog Collars & Leads; Dog Toys; Dog Wormer & Flea; STABLE: Show Preparation; STABLE: Supplements; Animals & Pet Supplies; Dog Rugs & Fashion; Dog Treats; Cat Gyms & Toys; Dog Accessories; STABLE: First Aid & Dressings; Dog Potions & Lotions; Dog Walking; Dog Bedding; Veterinary; Dog Grooming & Coat Care; Cat Food & Treats; Pet; Fly Control; STABLE: Clippers; Bird Potions & Lotions","Pet Supplements: 2; Horse Supplements: 2; Dog Collars & Leads: 28; Dog Toys: 27; Dog Wormer & Flea: 8; STABLE: Show Preparation: 1; STABLE: Supplements: 4; Animals & Pet Supplies: 1; Dog Rugs & Fashion: 12; Dog Treats: 30; Cat Gyms & Toys: 1; Dog Accessories: 24; STABLE: First Aid & Dressings: 2; Dog Potions & Lotions: 9; Dog Walking: 16; Dog Bedding: 1; Veterinary: 1; Dog Grooming & Coat Care: 20; Cat Food & Treats: 5; Pet: 51; Fly Control: 1; STABLE: Clippers: 3; Bird Potions & Lotions: 1"
trailrace-equestrian-outfitters,"Trailrace Equestrian Outfitters",250,,"Horse Rugs; Clothing - Clothing Accessories; Veterinary; Boots; Saddle Pad; Fly Control; Clothing; Clothing - Ladies Clothing; Strapping - Reins; Strapping - Strapping Accessories; Saddle Cloths; Feed Supplements; Strapping - Halters; Horse Boots; Spurs & Straps; Bits; Clothing - Kid's Clothing; Strapping - Breast Plates; Helmets; Racing; Girth Accessories; Accessories - Luggage; Stirrup Irons; Bits - Bit Accessories; Horse Rugs - Rug Accessories; Gloves; Strapping - Girths; Strapping - Girths - Girth Accessories; Halters; Care; Stirrup Irons - Stirrup Accessories; Spurs & Straps - Spurs Accessories; Saddles; Luggage; Clothing - Men's Clothing; Boots - Boot Accessories; Strapping - Bridles - Bridle Accessories; Strapping - Bridles; Strapping - Martingales; Western Pads; saddle pads; Helmet; Grooming","Horse Rugs: 17; Clothing - Clothing Accessories: 7; Veterinary: 32; Boots: 10; Saddle Pad: 2; Fly Control: 12; Clothing: 5; Clothing - Ladies Clothing: 28; Strapping - Reins: 3; Strapping - Strapping Accessories: 2; Saddle Cloths: 13; Feed Supplements: 7; Strapping - Halters: 4; Horse Boots: 12; Spurs & Straps: 5; Bits: 18; Clothing - Kid's Clothing: 8; Strapping - Breast Plates: 1; Helmets: 12; Racing: 2; Girth Accessories: 1; Accessories - Luggage: 1; Stirrup Irons: 6; Bits - Bit Accessories: 1; Horse Rugs - Rug Accessories: 2; Gloves: 6; Strapping - Girths: 4; Strapping - Girths - Girth Accessories: 1; Halters: 1; Care: 1; Stirrup Irons - Stirrup Accessories: 1; Spurs & Straps - Spurs Accessories: 1; Saddles: 1; Luggage: 3; Clothing - Men's Clothing: 4; Boots - Boot Accessories: 1; Strapping - Bridles - Bridle Accessories: 1; Strapping - Bridles: 3; Strapping - Martingales: 1; Western Pads: 3; saddle pads: 1; Helmet: 5; Grooming: 1"
dapple-eq,"Dapple EQ",250,,"Bag; quarter guard; Fly Mask; Breeches; Horse Boots & Leg Wraps; Travel Boots; Ladies Breeches; riding rug; backpack; stable Bag; Saddle Pads & Blankets; LADIES SHIRT; beanie; grooming; plaiting kit; brush; horse care; Saddle Pad; saddle pad; Shorts; Boots; jumper; Shirt; Belts; HAT; hats; Competition Jacket; UGG Boots; Care Products; Lead Rope; Hats; Wallet; Accessories; Fly Veil; Ankle Boots; Show Shirt; Horse Boots; Fetlock boots; Tendon Boots; breeches; casual footwear; Casual Jacket; t-shirt; Polo Shirt; Sweater; Apparel & Accessories; Shirts & Tops; TShirt; shirt; Boys Show Shirt; Polo Top; Socks; Mens Show Shirt; Halter; Horse Halters; Halter Set; Equestrian Helmets; Knitwear; Cap; Mens Competition Jacket; Trousers; Jeans; jacket; Boys Competition Jacket; Girls Breeches; long sleeve; Mens Breeches; Girls Competition Jacket; ladies jacket; Scarf","Bag: 5; quarter guard: 1; Fly Mask: 6; Breeches: 20; Horse Boots & Leg Wraps: 1; Travel Boots: 1; Ladies Breeches: 10; riding rug: 1; backpack: 1; stable Bag: 1; Saddle Pads & Blankets: 1; LADIES SHIRT: 1; beanie: 2; grooming: 5; plaiting kit: 1; brush: 5; horse care: 5; Saddle Pad: 10; saddle pad: 1; Shorts: 1; Boots: 1; jumper: 2; Shirt: 5; Belts: 13; HAT: 10; hats: 2; Competition Jacket: 9; UGG Boots: 1; Care Products: 11; Lead Rope: 2; Hats: 1; Wallet: 1; Accessories: 6; Fly Veil: 20; Ankle Boots: 3; Show Shirt: 11; Horse Boots: 1; Fetlock boots: 2; Tendon Boots: 3; breeches: 1; casual footwear: 2; Casual Jacket: 2; t-shirt: 3; Polo Shirt: 3; Sweater: 4; Apparel & Accessories: 1; Shirts & Tops: 1; TShirt: 2; shirt: 1; Boys Show Shirt: 2; Polo Top: 1; Socks: 10; Mens Show Shirt: 2; Halter: 4; Horse Halters: 1; Halter Set: 1; Equestrian Helmets: 1; Knitwear: 5; Cap: 2; Mens Competition Jacket: 2; Trousers: 1; Jeans: 4; jacket: 2; Boys Competition Jacket: 2; Girls Breeches: 2; long sleeve: 1; Mens Breeches: 1; Girls Competition Jacket: 1; ladies jacket: 1; Scarf: 1"
ascot-saddlery,"Ascot Saddlery",250,,"HORSE RUG CLEARANCE; Bird Food & Treats; STABLE: Wormers; RUGS: Winter Rugs, Neck Rugs & Hoods; STABLE: Show Preparation; STABLE: Grooming; RIDER: Gloves; RIDER: Body Protectors; HORSE: Flyveils & Bonnets; Cat Gyms & Toys; Dog Rugs & Fashion; HORSE: Number Holders; STABLE: First Aid & Dressings; Dog Accessories; RUGS: Summer Rugs, Neck Rugs & Hoods; Dog Collars & Leads; RIDER: Whips; STABLE: Stable Equipment; HORSE: Stock & Western; Dog Toys; Dog Wormer & Flea; STABLE: Horse Treats & Toys; STABLE: Leather Care & Proofing; STABLE: Supplements; STABLE: Feed Bins & Hay Bags; RIDER: Helmets; HORSE: Headstalls; HORSE: Horse Boots; RIDER: Giftware; RUGS: Rug Accessories; FOOTWEAR: Western & Roper Boots; CLOTHING: Hats & Caps; CLOTHING: Socks; STABLE: Clippers; Dog Kennels Carriers & Pens; HORSE: Lungeing & Schooling; FOOTWEAR CLEARANCE; RIDER: Luggage; SADDLES: All Purpose Saddles; Small Animal; Dog Treats; STABLE: Hoof Care; HORSE: Stirrup Leathers; SADDLES: Saddle Accessories & Gullets; STABLE: Farrier; RIDER: Spurs & Straps; HORSE: Leads & Snap Hooks; HORSE: Saddlecloths; HORSE: Bits; HORSE: Reins; HORSE: Racing & PVC; STABLE: Ice Boots; CLOTHING: Clothing Childs; CLOTHING: Clothing Ladies; CLOTHING: Jodhpurs & Breeches Childs; Dog Potions & Lotions; HORSE: Girths; RIDER: Glasses & Goggles; Dog Walking; Dog Bedding; Bird Cages & Furniture","HORSE RUG CLEARANCE: 1; Bird Food & Treats: 4; STABLE: Wormers: 4; RUGS: Winter Rugs, Neck Rugs & Hoods: 5; STABLE: Show Preparation: 12; STABLE: Grooming: 11; RIDER: Gloves: 4; RIDER: Body Protectors: 1; HORSE: Flyveils & Bonnets: 4; Cat Gyms & Toys: 2; Dog Rugs & Fashion: 3; HORSE: Number Holders: 1; STABLE: First Aid & Dressings: 8; Dog Accessories: 2; RUGS: Summer Rugs, Neck Rugs & Hoods: 5; Dog Collars & Leads: 13; RIDER: Whips: 5; STABLE: Stable Equipment: 6; HORSE: Stock & Western: 5; Dog Toys: 7; Dog Wormer & Flea: 3; STABLE: Horse Treats & Toys: 6; STABLE: Leather Care & Proofing: 11; STABLE: Supplements: 16; STABLE: Feed Bins & Hay Bags: 4; RIDER: Helmets: 2; HORSE: Headstalls: 3; HORSE: Horse Boots: 13; RIDER: Giftware: 10; RUGS: Rug Accessories: 3; FOOTWEAR: Western & Roper Boots: 4; CLOTHING: Hats & Caps: 2; CLOTHING: Socks: 1; STABLE: Clippers: 2; Dog Kennels Carriers & Pens: 1; HORSE: Lungeing & Schooling: 7; FOOTWEAR CLEARANCE: 1; RIDER: Luggage: 1; SADDLES: All Purpose Saddles: 1; Small Animal: 3; Dog Treats: 5; STABLE: Hoof Care: 1; HORSE: Stirrup Leathers: 2; SADDLES: Saddle Accessories & Gullets: 1; STABLE: Farrier: 6; RIDER: Spurs & Straps: 4; HORSE: Leads & Snap Hooks: 2; HORSE: Saddlecloths: 2; HORSE: Bits: 8; HORSE: Reins: 1; HORSE: Racing & PVC: 1; STABLE: Ice Boots: 5; CLOTHING: Clothing Childs: 1; CLOTHING: Clothing Ladies: 1; CLOTHING: Jodhpurs & Breeches Childs: 1; Dog Potions & Lotions: 2; HORSE: Girths: 2; RIDER: Glasses & Goggles: 1; Dog Walking: 4; Dog Bedding: 1; Bird Cages & Furniture: 2"
cavalleria-toscana,"Shop Cavalleria Toscana Equestrian Apparel & Horse Gear",250,,"Clothing - Clothing Accessories; Clothing; Clothing - Kid's Clothing; Clothing - Ladies Clothing; Clothing - Men's Clothing; Gloves; Saddle Cloths; Accessories; Stirrup Irons - Stirrup Accessories; Horse Boots; Whips; Ladies Clothing","Clothing - Clothing Accessories: 41; Clothing: 53; Clothing - Kid's Clothing: 18; Clothing - Ladies Clothing: 103; Clothing - Men's Clothing: 19; Gloves: 3; Saddle Cloths: 1; Accessories: 4; Stirrup Irons - Stirrup Accessories: 1; Horse Boots: 4; Whips: 1; Ladies Clothing: 2"
on-sale,"On Sale - Discount On The Best Brands & Gear",250,,"Horse Rugs; Veterinary; Horse Grooming; Sleepwear; STABLE: Wormers; Clothing - Clothing Accessories; Saddle Pad; Fly Control; Clothing; Clothing - Ladies Clothing; Strapping - Reins; Saddle Cloths; RUGS: Winter Rugs, Neck Rugs & Hoods; STABLE: Show Preparation; Boots; top; STABLE: Grooming; RIDER: Gloves; HORSE: Flyveils & Bonnets; Spurs & Straps; Bits; Clothing - Kid's Clothing; Strapping - Breast Plates; Saddlepads; Socks; Ultimate Tights; Shirt; Breeches; HORSE: Number Holders; STABLE: First Aid & Dressings; RUGS: Summer Rugs, Neck Rugs & Hoods; Horse Boots; Racing; Feed Supplements; Helmets; Accessories - Luggage; RIDER: Whips; STABLE: Stable Equipment; STABLE: Horse Treats & Toys; STABLE: Leather Care & Proofing; STABLE: Supplements; STABLE: Feed Bins & Hay Bags; RIDER: Helmets; HORSE: Headstalls; HORSE: Horse Boots; RIDER: Giftware; RUGS: Rug Accessories; CLOTHING: Hats & Caps; Rug; Stirrup Irons; (No Product Type); Freedom Tights; Girth; FOOTWEAR: Western & Roper Boots; CLOTHING: Socks; Gloves; Equestrian; Tights; Active Tights; beanies; STABLE: Clippers; HORSE: Lungeing & Schooling; Jodhpurs; SADDLES: All Purpose Saddles; HORSE: Stock & Western; Strapping - Girths; STABLE: Hoof Care; HORSE: Stirrup Leathers; SADDLES: Saddle Accessories & Gullets; STABLE: Farrier; RIDER: Spurs & Straps; HORSE: Leads & Snap Hooks; HORSE: Saddlecloths; HORSE: Bits; HORSE: Reins; HORSE: Racing & PVC; STABLE: Ice Boots; CLOTHING: Clothing Childs; CLOTHING: Jodhpurs & Breeches Childs; HORSE: Girths; RIDER: Glasses & Goggles","Horse Rugs: 5; Veterinary: 14; Horse Grooming: 1; Sleepwear: 2; STABLE: Wormers: 3; Clothing - Clothing Accessories: 3; Saddle Pad: 1; Fly Control: 7; Clothing: 2; Clothing - Ladies Clothing: 12; Strapping - Reins: 1; Saddle Cloths: 4; RUGS: Winter Rugs, Neck Rugs & Hoods: 5; STABLE: Show Preparation: 9; Boots: 3; top: 1; STABLE: Grooming: 10; RIDER: Gloves: 4; HORSE: Flyveils & Bonnets: 3; Spurs & Straps: 2; Bits: 4; Clothing - Kid's Clothing: 6; Strapping - Breast Plates: 1; Saddlepads: 1; Socks: 1; Ultimate Tights: 1; Shirt: 1; Breeches: 4; HORSE: Number Holders: 1; STABLE: First Aid & Dressings: 8; RUGS: Summer Rugs, Neck Rugs & Hoods: 5; Horse Boots: 7; Racing: 1; Feed Supplements: 4; Helmets: 1; Accessories - Luggage: 1; RIDER: Whips: 5; STABLE: Stable Equipment: 5; STABLE: Horse Treats & Toys: 6; STABLE: Leather Care & Proofing: 4; STABLE: Supplements: 11; STABLE: Feed Bins & Hay Bags: 4; RIDER: Helmets: 2; HORSE: Headstalls: 3; HORSE: Horse Boots: 8; RIDER: Giftware: 2; RUGS: Rug Accessories: 2; CLOTHING: Hats & Caps: 2; Rug: 1; Stirrup Irons: 1; (No Product Type): 1; Freedom Tights: 1; Girth: 1; FOOTWEAR: Western & Roper Boots: 1; CLOTHING: Socks: 1; Gloves: 1; Equestrian: 2; Tights: 1; Active Tights: 1; beanies: 1; STABLE: Clippers: 1; HORSE: Lungeing & Schooling: 6; Jodhpurs: 1; SADDLES: All Purpose Saddles: 1; HORSE: Stock & Western: 4; Strapping - Girths: 1; STABLE: Hoof Care: 1; HORSE: Stirrup Leathers: 2; SADDLES: Saddle Accessories & Gullets: 1; STABLE: Farrier: 6; RIDER: Spurs & Straps: 4; HORSE: Leads & Snap Hooks: 1; HORSE: Saddlecloths: 1; HORSE: Bits: 6; HORSE: Reins: 1; HORSE: Racing & PVC: 1; STABLE: Ice Boots: 1; CLOTHING: Clothing Childs: 1; CLOTHING: Jodhpurs & Breeches Childs: 1; HORSE: Girths: 2; RIDER: Glasses & Goggles: 1"
globo_basis_collection,"Globo basis collection - Do not delete",250,,"probiotics; Horse Rugs; Breeches; Clothing - Clothing Accessories; Helmet Brim; Veterinary; Horse Grooming; Sleepwear; HORSE RUG CLEARANCE; belts; (No Product Type); Horse Supplements; Boots; Accessories; Bird Food & Treats; STABLE: Wormers; Bicycle Helmet Brim Visor; Saddle Pad; Jodhpurs; Fly Control; Pet Supplements; Clothing; Clothing - Ladies Clothing; Strapping - Reins; Strapping - Strapping Accessories; Saddle Cloths; RUGS: Winter Rugs, Neck Rugs & Hoods; Feed Supplements; STABLE: Show Preparation; Hats & Accessories; Strapping - Halters; General; Coat, Hoof & Grooming; cap; top; Riding Apparel & Accessories; STABLE: Grooming; RIDER: Gloves; Horse Boots; RIDER: Body Protectors; HORSE: Flyveils & Bonnets; Jewellery; Spurs & Straps; DIY Kit; Bits; Clothing - Kid's Clothing; Strapping - Breast Plates; Helmets; Saddlepads; Socks; Bag; Ultimate Tights; Shirt; Cat Gyms & Toys; Belts & Bracelets; Apparel - Ladies; Dog Rugs & Fashion; Bell Boots; HORSE: Number Holders; STABLE: First Aid & Dressings; Dog Accessories; RUGS: Summer Rugs, Neck Rugs & Hoods; Dog Collars & Leads; Racing; Girth Accessories; Accessories - Luggage; RIDER: Whips; STABLE: Stable Equipment; HORSE: Stock & Western; Dog Toys; Dog Wormer & Flea; STABLE: Horse Treats & Toys; STABLE: Leather Care & Proofing; STABLE: Supplements; STABLE: Feed Bins & Hay Bags; RIDER: Helmets; HORSE: Headstalls; HORSE: Horse Boots; RIDER: Giftware; RUGS: Rug Accessories; FOOTWEAR: Western & Roper Boots; CLOTHING: Hats & Caps; Health Care; Horse Boots & Bandages; Rug; Stirrup Irons; Bits - Bit Accessories; Horse Rugs - Rug Accessories; quarter guard; Martingale Attachment; Handbag; Freedom Tights; Girth; Saddle Gullet; Default; Dogs; Hat; CLOTHING: Socks; Tights; Gloves; Equestrian; Animals & Pet Supplies; Necklace; Coat Care; Active Tights; shirt; breeches; shirts; beanies; Horse Grooming Combs, Brushes & Mitts; STABLE: Clippers; Dog Kennels Carriers & Pens; Lead Rope; Breeches & Riding Tights; HORSE: Lungeing & Schooling","probiotics: 1; Horse Rugs: 7; Breeches: 7; Clothing - Clothing Accessories: 3; Helmet Brim: 1; Veterinary: 15; Horse Grooming: 1; Sleepwear: 2; HORSE RUG CLEARANCE: 1; belts: 2; (No Product Type): 12; Horse Supplements: 4; Boots: 5; Accessories: 1; Bird Food & Treats: 1; STABLE: Wormers: 2; Bicycle Helmet Brim Visor: 1; Saddle Pad: 1; Jodhpurs: 2; Fly Control: 6; Pet Supplements: 2; Clothing: 1; Clothing - Ladies Clothing: 9; Strapping - Reins: 1; Strapping - Strapping Accessories: 1; Saddle Cloths: 4; RUGS: Winter Rugs, Neck Rugs & Hoods: 5; Feed Supplements: 4; STABLE: Show Preparation: 4; Hats & Accessories: 1; Strapping - Halters: 1; General: 1; Coat, Hoof & Grooming: 3; cap: 1; top: 1; Riding Apparel & Accessories: 1; STABLE: Grooming: 3; RIDER: Gloves: 1; Horse Boots: 4; RIDER: Body Protectors: 1; HORSE: Flyveils & Bonnets: 1; Jewellery: 3; Spurs & Straps: 4; DIY Kit: 3; Bits: 5; Clothing - Kid's Clothing: 7; Strapping - Breast Plates: 1; Helmets: 6; Saddlepads: 1; Socks: 1; Bag: 3; Ultimate Tights: 1; Shirt: 1; Cat Gyms & Toys: 1; Belts & Bracelets: 1; Apparel - Ladies: 3; Dog Rugs & Fashion: 1; Bell Boots: 1; HORSE: Number Holders: 2; STABLE: First Aid & Dressings: 4; Dog Accessories: 1; RUGS: Summer Rugs, Neck Rugs & Hoods: 3; Dog Collars & Leads: 1; Racing: 1; Girth Accessories: 1; Accessories - Luggage: 1; RIDER: Whips: 2; STABLE: Stable Equipment: 1; HORSE: Stock & Western: 1; Dog Toys: 2; Dog Wormer & Flea: 1; STABLE: Horse Treats & Toys: 2; STABLE: Leather Care & Proofing: 3; STABLE: Supplements: 2; STABLE: Feed Bins & Hay Bags: 1; RIDER: Helmets: 1; HORSE: Headstalls: 2; HORSE: Horse Boots: 3; RIDER: Giftware: 1; RUGS: Rug Accessories: 1; FOOTWEAR: Western & Roper Boots: 2; CLOTHING: Hats & Caps: 1; Health Care: 1; Horse Boots & Bandages: 3; Rug: 1; Stirrup Irons: 1; Bits - Bit Accessories: 1; Horse Rugs - Rug Accessories: 1; quarter guard: 1; Martingale Attachment: 1; Handbag: 1; Freedom Tights: 1; Girth: 1; Saddle Gullet: 2; Default: 1; Dogs: 1; Hat: 1; CLOTHING: Socks: 1; Tights: 2; Gloves: 1; Equestrian: 2; Animals & Pet Supplies: 1; Necklace: 1; Coat Care: 1; Active Tights: 1; shirt: 1; breeches: 1; shirts: 2; beanies: 1; Horse Grooming Combs, Brushes & Mitts: 1; STABLE: Clippers: 1; Dog Kennels Carriers & Pens: 1; Lead Rope: 1; Breeches & Riding Tights: 3; HORSE: Lungeing & Schooling: 2"
tacklet,"Tacklet",250,,"Saddlepads; Socks; Leads; Leather Care; Helmets; Coat Care; Stable Accessories; Hanoverian Bridle; Bits; Bitless Bridle; Hair Accessories; Number Holders; Hoof Care; Medical Supplies; Nosebandless Bridle; Bell Boots; Breastplates; Grooming; Fly Masks; Grackle Bridle; Whips and Crops; Lunge Line; Halter; Bandages; Riding Boots; Browbands; Ear Bonnets; Rug; Jackets; Anatomic Bridle; Breeches; Double Bridle; Stirrups; Noseband; Studs; Dog Collars & Leads; Tendon Boots; Magnetic Boots; Float Boots; Cold Water/Ice Boots; Saddle; Fly Boots; Half Pads; Reins; Other Care Products; Martingales; Girths; Jumping Boots; Back Protectors; Half Chaps; Tail Protector; Plaiting; Spurs; Belts; Rider Accessories; Fly Repellant; Dog Supplements; Shirts; Lunge Roller; Bridle Strapping","Saddlepads: 16; Socks: 2; Leads: 11; Leather Care: 1; Helmets: 7; Coat Care: 8; Stable Accessories: 7; Hanoverian Bridle: 4; Bits: 5; Bitless Bridle: 5; Hair Accessories: 8; Number Holders: 2; Hoof Care: 5; Medical Supplies: 4; Nosebandless Bridle: 1; Bell Boots: 6; Breastplates: 9; Grooming: 15; Fly Masks: 1; Grackle Bridle: 2; Whips and Crops: 6; Lunge Line: 2; Halter: 15; Bandages: 3; Riding Boots: 6; Browbands: 10; Ear Bonnets: 3; Rug: 13; Jackets: 2; Anatomic Bridle: 2; Breeches: 3; Double Bridle: 2; Stirrups: 1; Noseband: 4; Studs: 2; Dog Collars & Leads: 1; Tendon Boots: 3; Magnetic Boots: 2; Float Boots: 1; Cold Water/Ice Boots: 2; Saddle: 4; Fly Boots: 1; Half Pads: 2; Reins: 3; Other Care Products: 1; Martingales: 1; Girths: 10; Jumping Boots: 1; Back Protectors: 3; Half Chaps: 2; Tail Protector: 2; Plaiting: 4; Spurs: 1; Belts: 4; Rider Accessories: 3; Fly Repellant: 1; Dog Supplements: 1; Shirts: 2; Lunge Roller: 1; Bridle Strapping: 1"
shire-saddleworld,"Shire Saddleworld",250,,"General; (No Product Type); Martingale Attachment; Girth; Saddle Gullet; Default; Dogs; Hat; Grooming Bags and Brushes; Mens Footwear; Gloves; Mens Jeans; Dressage Pads","General: 1; (No Product Type): 236; Martingale Attachment: 1; Girth: 1; Saddle Gullet: 2; Default: 1; Dogs: 1; Hat: 1; Grooming Bags and Brushes: 1; Mens Footwear: 1; Gloves: 1; Mens Jeans: 2; Dressage Pads: 1"
samshield,"Shop Samshield Helmets & Equestrian Products",245,,"Clothing - Ladies Clothing; Helmets; Clothing - Clothing Accessories; Gloves; Helmet; Clothing; Clothing - Men's Clothing; Stirrup Irons; Ladies Clothing; Clothing Accessories","Clothing - Ladies Clothing: 122; Helmets: 44; Clothing - Clothing Accessories: 21; Gloves: 3; Helmet: 15; Clothing: 16; Clothing - Men's Clothing: 20; Stirrup Irons: 1; Ladies Clothing: 2; Clothing Accessories: 1"
top-brands,"Top Brands",223,,"Hats & Accessories; Coat, Hoof & Grooming; Jewellery; Belts & Bracelets; Apparel - Ladies; Health Care; Horse Boots & Bandages; Breeches & Riding Tights; The Trail of Painted Ponies; Books & Magazines; Gloves; Footwear & Chaps; Socks; Books","Hats & Accessories: 12; Coat, Hoof & Grooming: 6; Jewellery: 88; Belts & Bracelets: 12; Apparel - Ladies: 16; Health Care: 12; Horse Boots & Bandages: 23; Breeches & Riding Tights: 18; The Trail of Painted Ponies: 22; Books & Magazines: 4; Gloves: 6; Footwear & Chaps: 2; Socks: 1; Books: 1"
