Product Type,Count,Sample Products,Collections
"(No Product Type)",784,"head-bumper; busy-buddy-size-adjuster; western-felt-liner-with-fenders; velcro-bell-boot; thinline-insoles","horse-halters (Shop Horse Halters); thinline-global-australia (Shop Thinline Global Australia); globo_basis_collection (Globo basis collection - Do not delete); saddle-pads (Saddle Blankets, Pads & Squares); horse-boots (Horse Boots - All Types); footwear (Horse Riding Boots & Footwear, Trainers, Workers); horse-health (Horse Health & Nutrition); vivarchie-equestrian (Vivarchie Equestrian); horse-riding-apparel (Competition, Training & Casual - Horse Riding Clothes); bare-equestrian (Shop BARE Equestrian Apparel & Gear); on-sale (On Sale - Discount On The Best Brands & Gear); horse-grooming-supplies (Horse Grooming Gear & Accessories); stable-and-yard (Stable & Arena Gear); horse-rugs (Horse Rugs - All Types); horseware-australia (Horseware Australia); eurohunter (Shop Eurohunter Equestrian Gear & Accessories); the-equestrian (The Equestrian); fly-veils-and-hoods (Mask & Fly Veils For Horses & Ponies); ps-of-sweden (PS Of Sweden); premier-equine (Premier Equine); base-layers (Shop Horse Riding Base Layers); breeches (Horse Riding Breeches - Quality International & National Brands); stirrups (Shop Horse Riding Stirrups & Leathers); visentin-equestrian (Visentin Equestrian); strapping (Bridles & Strapping - Top Brands For All Disciplines); ippico-equestrian (Ippico Equestrian); tacklet (Tacklet); shire-saddleworld (Shire Saddleworld); hitchley-harrow (Hitchley & Harrow); qj-riding-wear (QJ Riding Wear); accessories (Accessories); little-equine-co (Little Equine Co); cavallo (Shop Cavallo Products); eac-animal-care (EAC Animal Care)"
"Clothing - Ladies Clothing",423,"ariat-auburn-baselayer; ariat-sunstopper-team-2-0-1-4-zip; ariat-sunstopper-2-0-1-4-zip; ariat-ladies-team-polo; ariat-tek-team-1-2-zip-sweatshirt","horse-riding-apparel (Competition, Training & Casual - Horse Riding Clothes); trailrace-equestrian-outfitters (Trailrace Equestrian Outfitters); on-sale (On Sale - Discount On The Best Brands & Gear); base-layers (Shop Horse Riding Base Layers); ariat (Shop & Buy Ariat Clothing & Footwear); globo_basis_collection (Globo basis collection - Do not delete); accessories (Accessories); footwear (Horse Riding Boots & Footwear, Trainers, Workers); bare-equestrian (Shop BARE Equestrian Apparel & Gear); cavalleria-toscana (Shop Cavalleria Toscana Equestrian Apparel & Horse Gear); breeches (Horse Riding Breeches - Quality International & National Brands); horse-boots (Horse Boots - All Types); samshield (Shop Samshield Helmets & Equestrian Products); elt (ELT  Equestrian); ego-7 (Ego 7)"
"Dog Collars & Leads",243,"anipal-dog-leash-billie-the-bilby; anipal-dog-collar-kylo-the-koala; anipal-dog-leash-piper-the-platypus; choker-chain-pp-2-0mm; choker-chain-pp-4-0mm","pets (Pets - Products For Dogs, Cats, & Other Small Animals); ascot-saddlery (Ascot Saddlery); globo_basis_collection (Globo basis collection - Do not delete); strapping (Bridles & Strapping - Top Brands For All Disciplines); on-sale (On Sale - Discount On The Best Brands & Gear); tacklet (Tacklet)"
"Dog Toys",228,"aroma-dog-toy-calming-fleece-flatty-51cm; aroma-dog-toy-calming-fleece-security-blanket-30cm; aroma-dog-toy-calming-fleece-man-dog-toy-24cm; aroma-dog-toy-calming-squeaker-mat-32cm; aroma-dog-toy-senior-fleece-floppy-blankie-body-33cm","pets (Pets - Products For Dogs, Cats, & Other Small Animals); ascot-saddlery (Ascot Saddlery); globo_basis_collection (Globo basis collection - Do not delete); birds (Shop Birds - Feed, Treats, Accessories, Supplies)"
"Dog Treats",204,"blackdog-beef-bone-filled-with-beef; blackdog-beef-bone-filled-with-chicken; blackdog-beef-clod-bone-each; blackdog-beef-cow-ears-pack10; blackdog-beef-jerky-straps-150gm","pets (Pets - Products For Dogs, Cats, & Other Small Animals); ascot-saddlery (Ascot Saddlery); globo_basis_collection (Globo basis collection - Do not delete); horse-health (Horse Health & Nutrition)"
"Horse Boots",199,"unlined-waler-canvas-rug; ca-stable-bandages; aubenhausen-bandage-pads; bandage-pads-set-of-2; ca-come-best-bandage-pad","horse-rugs (Horse Rugs - All Types); trailrace-equestrian-outfitters (Trailrace Equestrian Outfitters); globo_basis_collection (Globo basis collection - Do not delete); horse-bandages (Leg Wraps & Bandages For Your Horse Or Pony); on-sale (On Sale - Discount On The Best Brands & Gear); horse-boots (Horse Boots - All Types); cavalleria-toscana (Shop Cavalleria Toscana Equestrian Apparel & Horse Gear); accessories (Accessories); kentucky (Shop Kentucky Horsewear - Boots, Pads, Bonnets, Girths, Bandages & More); horse-riding-apparel (Competition, Training & Casual - Horse Riding Clothes); ps-of-sweden (PS Of Sweden); dapple-eq (Dapple EQ); the-equestrian (The Equestrian); eurohunter (Shop Eurohunter Equestrian Gear & Accessories); horse-health (Horse Health & Nutrition); thinline-global-australia (Shop Thinline Global Australia); saddle-pads (Saddle Blankets, Pads & Squares); zilco (Shop Zilco Rugs, Horse Boots & Accessories); shire-saddleworld (Shire Saddleworld)"
"Bits",187,"bombers-2-5-ring-mchardy; bombers-3-ring-mchardy; bombers-2-5-ring-elliptical-dressage; bombers-2-1-2-ring-elliptical-ultra-comfy; bombers-blue-williams","horse-bits (Shop & Buy Horse Bits - Quality Brands - All Types); trailrace-equestrian-outfitters (Trailrace Equestrian Outfitters); globo_basis_collection (Globo basis collection - Do not delete); shire-saddleworld (Shire Saddleworld); zilco (Shop Zilco Rugs, Horse Boots & Accessories); tacklet (Tacklet)"
"STABLE: Grooming",175,"body-brush-flexible-gg-blue; body-brush-huntington-multi-colour; body-brush-huntington-goat-hair; body-brush-rainbow-showmaster; body-brush-salmon-english-tampico-fibre","horse-grooming-supplies (Horse Grooming Gear & Accessories); ascot-saddlery (Ascot Saddlery); globo_basis_collection (Globo basis collection - Do not delete); the-barbie-collection (The Barbie Collection); horse-riding-apparel (Competition, Training & Casual - Horse Riding Clothes); strapping (Bridles & Strapping - Top Brands For All Disciplines); hairy-pony (Shop Hairy Pony Grooming Products)"
"STABLE: Supplements",170,"anitone-1litre; betavet-echinacea-250ml; betavet-electrolift-30gm; betavet-steady-stead-30gm; betavet-super-boost-30gm","horse-health (Horse Health & Nutrition); ascot-saddlery (Ascot Saddlery); globo_basis_collection (Globo basis collection - Do not delete); on-sale (On Sale - Discount On The Best Brands & Gear); pets (Pets - Products For Dogs, Cats, & Other Small Animals); horse-grooming-supplies (Horse Grooming Gear & Accessories); farrier-tools (Shop Farrier Tools); birds (Shop Birds - Feed, Treats, Accessories, Supplies)"
"HORSE: Bits",169,"anti-rearing-bit-port-mouth-chrome-plated-12-5cm-5-0; anti-rearing-head-leather-aintree-chicago-screw-fitting-black; anti-rearing-head-leather-aintree-chicago-screw-fitting-brown; anti-rearing-head-strap-pvc-buckle-end; anti-rearing-head-strap-pvc-loop-end","ascot-saddlery (Ascot Saddlery); globo_basis_collection (Globo basis collection - Do not delete); zilco (Shop Zilco Rugs, Horse Boots & Accessories); horse-bandages (Leg Wraps & Bandages For Your Horse Or Pony); horse-bits (Shop & Buy Horse Bits - Quality Brands - All Types); strapping (Bridles & Strapping - Top Brands For All Disciplines); on-sale (On Sale - Discount On The Best Brands & Gear)"
"Veterinary",157,"bandage-scissors; absorbine-hooflex-frog-and-sole-care; arcequine-microcurrent-device; betavet-arnica-magic; betavet-cool-n-tite-500ml","horse-bandages (Leg Wraps & Bandages For Your Horse Or Pony); horse-health (Horse Health & Nutrition); trailrace-equestrian-outfitters (Trailrace Equestrian Outfitters); globo_basis_collection (Globo basis collection - Do not delete); horse-grooming-supplies (Horse Grooming Gear & Accessories); pets (Pets - Products For Dogs, Cats, & Other Small Animals); on-sale (On Sale - Discount On The Best Brands & Gear); eurohunter (Shop Eurohunter Equestrian Gear & Accessories); horse-rugs (Horse Rugs - All Types)"
"Default",152,"arena-high-wither-all-purpose-black-42cm-16-5; active-everyday-riding-legging; pure-western-womens-tyler-boot-rust-oiled-grape; tanami-competitor-saddle-pad-13mm-white; ariat-bandana-light-pink","globo_basis_collection (Globo basis collection - Do not delete); shire-saddleworld (Shire Saddleworld); on-sale (On Sale - Discount On The Best Brands & Gear); eurohunter (Shop Eurohunter Equestrian Gear & Accessories); zilco (Shop Zilco Rugs, Horse Boots & Accessories)"
"Clothing",151,"bare-emblem-t-shirt-ruby; bare-emblem-t-shirt-youth-ice-blue; bare-emblem-t-shirt-youth-pistachio; bare-emblem-t-shirt-youth-ruby; aztec-diamond-scribble-print-t-shirt","horse-riding-apparel (Competition, Training & Casual - Horse Riding Clothes); trailrace-equestrian-outfitters (Trailrace Equestrian Outfitters); bare-equestrian (Shop BARE Equestrian Apparel & Gear); globo_basis_collection (Globo basis collection - Do not delete); on-sale (On Sale - Discount On The Best Brands & Gear); base-layers (Shop Horse Riding Base Layers); cavalleria-toscana (Shop Cavalleria Toscana Equestrian Apparel & Horse Gear); accessories (Accessories); breeches (Horse Riding Breeches - Quality International & National Brands); equipe (Shop Equipe); elt (ELT  Equestrian); samshield (Shop Samshield Helmets & Equestrian Products); ariat (Shop & Buy Ariat Clothing & Footwear); gifts (Horse & Equine Gifts); ego-7 (Ego 7)"
"Cat Gyms & Toys",133,"cat-toy-cataction-featherlite-boa-squeaky-33cm; cat-toy-catfish-doorknob-hanger; cat-toy-dangler-ass-colours; cat-toy-feather-wand-45cm-wand-dangler; cat-toy-frolicat-multi-laser-automatic-laser-light","ascot-saddlery (Ascot Saddlery); globo_basis_collection (Globo basis collection - Do not delete); pets (Pets - Products For Dogs, Cats, & Other Small Animals); birds (Shop Birds - Feed, Treats, Accessories, Supplies)"
"STABLE: Show Preparation",117,"absorbine-showsheen-946ml; absorbine-hoof-polish-200ml; aloveen-shampoo-1lit; aloveen-shampoo-500ml; alto-lab-dung-away-sprayer-500ml","horse-grooming-supplies (Horse Grooming Gear & Accessories); ascot-saddlery (Ascot Saddlery); globo_basis_collection (Globo basis collection - Do not delete); pets (Pets - Products For Dogs, Cats, & Other Small Animals); birds (Shop Birds - Feed, Treats, Accessories, Supplies); horse-health (Horse Health & Nutrition); hairy-pony (Shop Hairy Pony Grooming Products)"
"Helmets",112,"artemis-riding-helmet; charles-owen-ayr8-plus-leather-look; charles-owen-4-star-helmet; charles-owen-fian; charles-owen-halo-matte-mips","horse-riding-helmets (Buy Horse Riding Helmets For Equestrians); trailrace-equestrian-outfitters (Trailrace Equestrian Outfitters); globo_basis_collection (Globo basis collection - Do not delete); horse-riding-apparel (Competition, Training & Casual - Horse Riding Clothes); cavalleria-toscana (Shop Cavalleria Toscana Equestrian Apparel & Horse Gear); on-sale (On Sale - Discount On The Best Brands & Gear); samshield (Shop Samshield Helmets & Equestrian Products); shire-saddleworld (Shire Saddleworld); zilco (Shop Zilco Rugs, Horse Boots & Accessories); eurohunter (Shop Eurohunter Equestrian Gear & Accessories); tacklet (Tacklet)"
"Clothing - Clothing Accessories",111,"ariat-crew-socks-3-pack; bare-ecoluxe-socks-youth; cavalleria-toscana-coated-cap; cavalleria-toscana-elastic-navy-belt; cavalleria-toscana-laser-cut-leather-belt-mens","footwear (Horse Riding Boots & Footwear, Trainers, Workers); horse-riding-apparel (Competition, Training & Casual - Horse Riding Clothes); trailrace-equestrian-outfitters (Trailrace Equestrian Outfitters); on-sale (On Sale - Discount On The Best Brands & Gear); ariat (Shop & Buy Ariat Clothing & Footwear); globo_basis_collection (Globo basis collection - Do not delete); bare-equestrian (Shop BARE Equestrian Apparel & Gear); cavalleria-toscana (Shop Cavalleria Toscana Equestrian Apparel & Horse Gear); accessories (Accessories); equipe (Shop Equipe); gifts (Horse & Equine Gifts); samshield (Shop Samshield Helmets & Equestrian Products); kentucky (Shop Kentucky Horsewear - Boots, Pads, Bonnets, Girths, Bandages & More); ego-7 (Ego 7)"
"Saddle Cloths",110,"acavallo-piuma-air-release-pad-featherlight; acavallo-shaped-gel-front-riser-only; active-soft-gel-anti-slip-pad; aubenhausen-classics-fleece-saddle-pad-dressage; bracelet-trim-dressage-saddlecloth","saddle-pads (Saddle Blankets, Pads & Squares); trailrace-equestrian-outfitters (Trailrace Equestrian Outfitters); globo_basis_collection (Globo basis collection - Do not delete); acavallo (Shop Acavallo Horse Riding Essentials); on-sale (On Sale - Discount On The Best Brands & Gear); cavalleria-toscana (Shop Cavalleria Toscana Equestrian Apparel & Horse Gear); horse-riding-apparel (Competition, Training & Casual - Horse Riding Clothes); accessories (Accessories); equipe (Shop Equipe); kentucky (Shop Kentucky Horsewear - Boots, Pads, Bonnets, Girths, Bandages & More); horse-health (Horse Health & Nutrition); thinline-global-australia (Shop Thinline Global Australia); zilco (Shop Zilco Rugs, Horse Boots & Accessories)"
"HORSE: Horse Boots",104,"bandage-aintree-tail-polyester-10cm; bandage-pads-felt-showmaster-30cm-x-45cm-set-of-4-white; bandages-nylon-10cm-aintree-set-of-4; bandages-polar-fleece-eurohunter; bandages-polo-cowdray-park-set-4","horse-bandages (Leg Wraps & Bandages For Your Horse Or Pony); ascot-saddlery (Ascot Saddlery); globo_basis_collection (Globo basis collection - Do not delete); eurohunter (Shop Eurohunter Equestrian Gear & Accessories); horse-boots (Horse Boots - All Types); on-sale (On Sale - Discount On The Best Brands & Gear); zilco (Shop Zilco Rugs, Horse Boots & Accessories); horse-health (Horse Health & Nutrition); the-barbie-collection (The Barbie Collection)"
"RIDER: Giftware",102,"book-stephen-irwin-contention; book-stephen-irwin-providence; book-stephen-irwin-retribution; book-stephen-irwin-untouchable; bracelet-on-the-bit-black","ascot-saddlery (Ascot Saddlery); horse-books (Books - Fiction & Non Fiction); globo_basis_collection (Globo basis collection - Do not delete); horse-toys (Shop Kids Horse Toys); strapping (Bridles & Strapping - Top Brands For All Disciplines); horse-riding-apparel (Competition, Training & Casual - Horse Riding Clothes); anna-scarpati (Shop Anna Scarpati)"
"HORSE: Racing & PVC",102,"cheekers-face-stay; curb-chain-strap-pvc; exercise-girth-surcingle-set-elastic-one-end; exercise-girth-horsesense-elastic-3-x-46; exercise-girth-only-elastic-one-end-50inch","ascot-saddlery (Ascot Saddlery); globo_basis_collection (Globo basis collection - Do not delete); strapping (Bridles & Strapping - Top Brands For All Disciplines); stirrups (Shop Horse Riding Stirrups & Leathers); zilco (Shop Zilco Rugs, Horse Boots & Accessories); horse-halters (Shop Horse Halters)"
"HORSE: Saddlecloths",99,"saddlecloth-all-purpose-pocket-puffer-navy-blue; saddlecloth-air-cell; saddlecloth-all-purpose-basics-orange; saddlecloth-all-purpose-bates-black-full; saddlecloth-all-purpose-bracelet-trim-navy","saddle-pads (Saddle Blankets, Pads & Squares); ascot-saddlery (Ascot Saddlery); zilco (Shop Zilco Rugs, Horse Boots & Accessories); globo_basis_collection (Globo basis collection - Do not delete); eurohunter (Shop Eurohunter Equestrian Gear & Accessories); on-sale (On Sale - Discount On The Best Brands & Gear); the-equestrian (The Equestrian)"
"HORSE: Leads & Snap Hooks",95,"braided-lead-rope; braided-soft-polypropylene-two-tone-lead-2-5mt-black-silver; braided-rose-shine-lead-elt-2mt-black; braided-soft-polypropylene-two-tone-lead-2-5mt-lime-dark-green; braided-soft-polypropylene-two-tone-lead-2-5mt-pink-black","ascot-saddlery (Ascot Saddlery); zilco (Shop Zilco Rugs, Horse Boots & Accessories); globo_basis_collection (Globo basis collection - Do not delete); eurohunter (Shop Eurohunter Equestrian Gear & Accessories); horse-halters (Shop Horse Halters)"
"General",95,"bates-artiste-classic; junior-gear-bag; horze-rectangular-anti-slip-pad; horze-cairo-infra-red-dressage-saddle-pad-full; vanity-bag","globo_basis_collection (Globo basis collection - Do not delete); shire-saddleworld (Shire Saddleworld); on-sale (On Sale - Discount On The Best Brands & Gear)"
"Dog Grooming & Coat Care",91,"furminator-large-dog-long-hair; furminator-large-dog-short-hair; furminator-medium-dog-long-hair; furminator-medium-dog-short-hair; furminator-nail-grinder","pets (Pets - Products For Dogs, Cats, & Other Small Animals); ascot-saddlery (Ascot Saddlery); globo_basis_collection (Globo basis collection - Do not delete); horse-grooming-supplies (Horse Grooming Gear & Accessories); on-sale (On Sale - Discount On The Best Brands & Gear); ponyjet (Ponyjet); the-equestrian (The Equestrian)"
"Jewellery",90,"kelly-herd-6mm-bit-ring; kelly-herd-blue-clear-horseshoe-ring; kelly-herd-blue-stone-horseshoe-necklace-sterling-silver; kelly-herd-bracelet-double-horseshoe-sterling-silver; kelly-herd-bracelet-double-horseshoe-rose-gold","horse-halters (Shop Horse Halters); horse-jewellery (Horse Jewellery - Equine & Equestrian Themed); top-brands (Top Brands); globo_basis_collection (Globo basis collection - Do not delete); horse-riding-apparel (Competition, Training & Casual - Horse Riding Clothes); the-equestrian (The Equestrian); on-sale (On Sale - Discount On The Best Brands & Gear); tacklet (Tacklet)"
"Dog Accessories",90,"bark-collar-spray-petsafe; bark-collar-ultrasonic-petsafe; bark-spray-refill-citronella; bark-control-unit-outdoor-ultrasonic-petsafe; bark-spray-refill-citronella-can","pets (Pets - Products For Dogs, Cats, & Other Small Animals); ascot-saddlery (Ascot Saddlery); globo_basis_collection (Globo basis collection - Do not delete); birds (Shop Birds - Feed, Treats, Accessories, Supplies); strapping (Bridles & Strapping - Top Brands For All Disciplines)"
"Breeches",86,"animo-madox-mens-breeches; animo-ministro-mens-full-grip-breeches; animo-namiro-ladies-breeches; animo-nom-ladies-breeches; animo-noa-full-grip-breeches","horse-riding-apparel (Competition, Training & Casual - Horse Riding Clothes); dapple-eq (Dapple EQ); animo (Shop Animo Equestrian Gear); on-sale (On Sale - Discount On The Best Brands & Gear); breeches (Horse Riding Breeches - Quality International & National Brands); globo_basis_collection (Globo basis collection - Do not delete); anna-scarpati (Shop Anna Scarpati); little-equine-co (Little Equine Co); cavallo (Shop Cavallo Products); jp-equestrian-fashion (JP Equestrian Fashion); plum-tack (Plum Tack - Quality Australia Riding Apparel & Clothing); run-away-equestrian-co (Runaway Equestrian Co.); qj-riding-wear (QJ Riding Wear); jnk-collective (JNK Collective); shire-saddleworld (Shire Saddleworld); tacklet (Tacklet); penelope-leprovost (Shop Penelope Leprovost Equestrian Gear & Apparel)"
"Womens",85,"ariat-wms-sunstopper-3-0-laurel-green; ariat-wms-taryn-ss-polo-duck-green; bv-sidney-training-shirt; horze-stella-rain-jacket; ariat-womens-prix-2-0-polo-forest-green","on-sale (On Sale - Discount On The Best Brands & Gear); ariat (Shop & Buy Ariat Clothing & Footwear); globo_basis_collection (Globo basis collection - Do not delete); shire-saddleworld (Shire Saddleworld); base-layers (Shop Horse Riding Base Layers)"
"STABLE: First Aid & Dressings",80,"absorbine-ultra-shield-ex-475ml; alto-lab-bugshield-insect-repellent-500ml; animalintex; bandage-elastick-10cm-x-4-5mt; bandage-equitex-chew-prevention","horse-grooming-supplies (Horse Grooming Gear & Accessories); ascot-saddlery (Ascot Saddlery); globo_basis_collection (Globo basis collection - Do not delete); pets (Pets - Products For Dogs, Cats, & Other Small Animals); horse-bandages (Leg Wraps & Bandages For Your Horse Or Pony); horse-health (Horse Health & Nutrition); eurohunter (Shop Eurohunter Equestrian Gear & Accessories); birds (Shop Birds - Feed, Treats, Accessories, Supplies)"
"HORSE: Headstalls",79,"bitless-bridle-reins-rainbow-rancher; foal-catcher-leather-foal-weanling; foal-headstall-gymkhana-red; foal-headstall-gymkhana-burgundy; foal-headstall-gymkhana-royal-blue","horse-halters (Shop Horse Halters); ascot-saddlery (Ascot Saddlery); globo_basis_collection (Globo basis collection - Do not delete); zilco (Shop Zilco Rugs, Horse Boots & Accessories); on-sale (On Sale - Discount On The Best Brands & Gear); the-barbie-collection (The Barbie Collection); eurohunter (Shop Eurohunter Equestrian Gear & Accessories)"
"Dog Potions & Lotions",74,"adaptil-calm-home-diffuser-ceva-48ml; adaptil-refill-ceva-48ml; aristopet-dog-repel-outdoor-1kg; aristopet-dog-repel-outdoor-400gm; aristopet-dog-repel-spray-house-125ml","pets (Pets - Products For Dogs, Cats, & Other Small Animals); ascot-saddlery (Ascot Saddlery); globo_basis_collection (Globo basis collection - Do not delete); birds (Shop Birds - Feed, Treats, Accessories, Supplies); horse-grooming-supplies (Horse Grooming Gear & Accessories); horse-health (Horse Health & Nutrition)"
"Cat Accessories",67,"bowl-plastic-double-k9; cat-bowl-face-scream-loud-blue; cat-bowl-face-scream-loud-green; cat-bowl-face-scream-loud-orange; cat-bowl-face-scream-loud-pink","ascot-saddlery (Ascot Saddlery); globo_basis_collection (Globo basis collection - Do not delete); pets (Pets - Products For Dogs, Cats, & Other Small Animals)"
"STABLE: Stable Equipment",65,"blanket-bar-90cm-black; blocker-tie-ring; bridle-bracket-brass-plated; bridle-bracket-pvc-coated; bridle-rack-5-bridle-black","ascot-saddlery (Ascot Saddlery); globo_basis_collection (Globo basis collection - Do not delete); strapping (Bridles & Strapping - Top Brands For All Disciplines); horse-health (Horse Health & Nutrition)"
"Clothing - Men's Clothing",63,"cavalleria-toscana-mens-club-zip-jacket; cavalleria-toscana-mens-tails-line-frack; cavalleria-toscana-mens-tech-knit-bomber; cavalleria-toscana-mens-gp-riding-jacket; cavalleria-toscana-mens-compression-breeches","horse-riding-apparel (Competition, Training & Casual - Horse Riding Clothes); trailrace-equestrian-outfitters (Trailrace Equestrian Outfitters); cavalleria-toscana (Shop Cavalleria Toscana Equestrian Apparel & Horse Gear); on-sale (On Sale - Discount On The Best Brands & Gear); globo_basis_collection (Globo basis collection - Do not delete); breeches (Horse Riding Breeches - Quality International & National Brands); horse-boots (Horse Boots - All Types); samshield (Shop Samshield Helmets & Equestrian Products)"
"Cat Food & Treats",63,"a-la-carte-cat-salmon-rice-2-5kg; blackcat-cat-treat-chicken-delites-60gm; blackcat-cat-treat-fish-delites-60gm; blackcat-cat-treat-lamb-delites-60gm; blackcat-cat-treat-ocean-fish-30gm","ascot-saddlery (Ascot Saddlery); globo_basis_collection (Globo basis collection - Do not delete); pets (Pets - Products For Dogs, Cats, & Other Small Animals)"
"Helmet",58,"aramis-riding-helmet; charles-owen-halo-gloss; charles-owen-halo-matte; kask-helmet-inner-padding; kask-lateral-inserts","horse-riding-helmets (Buy Horse Riding Helmets For Equestrians); trailrace-equestrian-outfitters (Trailrace Equestrian Outfitters); globo_basis_collection (Globo basis collection - Do not delete); on-sale (On Sale - Discount On The Best Brands & Gear); samshield (Shop Samshield Helmets & Equestrian Products)"
"Hats & Accessories",57,"resistol-ride-safe-helmet-straw; toptac-english-hat-box-accessories-brown; toptac-english-hat-box-accessories-tan; hat-cleaning-sponges-pack-of-2; toptac-western-accessories-box-for-hat-can-black","horse-riding-helmets (Buy Horse Riding Helmets For Equestrians); top-brands (Top Brands); globo_basis_collection (Globo basis collection - Do not delete)"
"Boots",56,"ariat-duraterrain-h20-mens; ariat-durayard-h20-ladies; ariat-duraterrain-h20-ladies; ariat-durayard-h20-mens; action-all-purpose-equestrian-boot","footwear (Horse Riding Boots & Footwear, Trainers, Workers); trailrace-equestrian-outfitters (Trailrace Equestrian Outfitters); ariat (Shop & Buy Ariat Clothing & Footwear); globo_basis_collection (Globo basis collection - Do not delete); on-sale (On Sale - Discount On The Best Brands & Gear); horse-riding-apparel (Competition, Training & Casual - Horse Riding Clothes); ego-7 (Ego 7); saddle-pads (Saddle Blankets, Pads & Squares); elt (ELT  Equestrian); accessories (Accessories); horse-boots (Horse Boots - All Types); vivarchie-equestrian (Vivarchie Equestrian); dapple-eq (Dapple EQ)"
"Dog Walking",56,"coralpina-cinquetorri-waste-bag-black; coralpina-cinquetorri-waste-bag-electric-blue; coralpina-cinquetorri-waste-bag-fluro-pink; coralpina-cinquetorri-waste-bag-light-grey; coralpina-cinquetorri-waste-bag-red-wine","pets (Pets - Products For Dogs, Cats, & Other Small Animals); ascot-saddlery (Ascot Saddlery); globo_basis_collection (Globo basis collection - Do not delete); accessories (Accessories); luggage (Luggage For The Horse Rider)"
