Product Type,Count,Sample Products,Collections
"Dressage Pads",5,"kentucky-saddle-pad-leather-dressage-corale; grainge-velvet-dressage-pad-black; grainge-velvet-dressage-pad-dark-blue; b-vertigo-calgary-dressage-saddlepad; b-vertigo-cameron-navy-set-full-saddle-pad-bonnet","on-sale (On Sale - Discount On The Best Brands & Gear); globo_basis_collection (Globo basis collection - Do not delete); shire-saddleworld (Shire Saddleworld)"
"Half Pads",5,"design-your-own-e-a-mattes-half-pad; pony-lambswool-saddle-pad; anti-slip-airflow-shockproof-racing-training-saddle-pad; airtechnology-shockproof-wool-saddle-pad-half-pad; lambswool-saddle-pad","saddle-pads (Saddle Blankets, Pads & Squares); globo_basis_collection (Globo basis collection - Do not delete); tacklet (Tacklet)"
"Magnetic Boots",5,"magni-teque-boot-wrap-liners; magni-teque-magnetic-hoof-boots; magni-teque-magnetic-hock-boots; magni-teque-magnetic-boot-wraps; magni-teque-magnetic-fetlock-boots","globo_basis_collection (Globo basis collection - Do not delete); tacklet (Tacklet)"
"Noseband",5,"rope-noseband; melodie-noseband-patent-white-padding; fancy-stitch-padded-wave-cavesson-noseband; hanoverian-noseband-rolled-patent; hanoverian-noseband-flat-patent","globo_basis_collection (Globo basis collection - Do not delete); tacklet (Tacklet)"
"brush",5,"queens-brush-mane-tail; hairy-pony-face-brush; hairy-pony-quater-mark-brush; hairy-pony-wool-brush; hairy-pony-wash-bay-brush","dapple-eq (Dapple EQ); globo_basis_collection (Globo basis collection - Do not delete); hairy-pony (Shop Hairy Pony Grooming Products)"
"horse care",5,"epona-quilted-cloud-cloth; trm-hoofmaker-concentrated-pellet; trm-cool-it-mag; trm-kurasyn-360x; pure-steed-indiglo-brightening-shampoo","dapple-eq (Dapple EQ); globo_basis_collection (Globo basis collection - Do not delete)"
"grooming",5,"epona-butterfly-groomer-curry-brush; hairy-pony-luxury-horse-sweat-scraper; hairy-pony-2-in-1-horse-detangle-spray; hairy-pony-original-brush-kit; hairy-pony-flat-waxed-horse-plaiting-thread","dapple-eq (Dapple EQ); globo_basis_collection (Globo basis collection - Do not delete); hairy-pony (Shop Hairy Pony Grooming Products)"
"Bitless Bridle",5,"seline-bitless-bridle-no-reins; skyla-bitless-bridle-no-reins; symphony-bitless-bridle-no-reins; santiago-bitless-bridle-no-reins; astra-sidepull-bridle","globo_basis_collection (Globo basis collection - Do not delete); tacklet (Tacklet)"
"Saddlepad",4,"premier-equine-close-contact-cotton-gp-jump-square; premier-equine-close-contact-tech-grip-pro-anti-slip-saddle-pad-dressage-square; premier-equine-close-contact-tech-grip-pro-anti-slip-saddle-pad-gp-jump-square; premier-equine-cotton-gp-jump-square","saddle-pads (Saddle Blankets, Pads & Squares); globo_basis_collection (Globo basis collection - Do not delete); the-equestrian (The Equestrian)"
"Saddle Cloth",4,"ca-performers-fleece-saddle-pad; ca-performers-saddle-pad; estate-fleece-saddlecloth-dressage; grenoble-saddle-cloth","saddle-pads (Saddle Blankets, Pads & Squares); trailrace-equestrian-outfitters (Trailrace Equestrian Outfitters); on-sale (On Sale - Discount On The Best Brands & Gear); globo_basis_collection (Globo basis collection - Do not delete)"
"Bridle Accessories",4,"ca-performers-ear-bonnet; aubenhausen-classics-ear-bonnet; equipe-patent-bling-browband-br64; equipe-browband-br35","horse-health (Horse Health & Nutrition); trailrace-equestrian-outfitters (Trailrace Equestrian Outfitters); fly-veils-and-hoods (Mask & Fly Veils For Horses & Ponies); on-sale (On Sale - Discount On The Best Brands & Gear); globo_basis_collection (Globo basis collection - Do not delete); strapping (Bridles & Strapping - Top Brands For All Disciplines); equipe (Shop Equipe)"
"Bits - Bit Accessories",4,"bitbutter-bit-balm-softening-balm; pelham-rounding-leather; rubber-bit-guards; dyon-hackamore-protection","horse-bits (Shop & Buy Horse Bits - Quality Brands - All Types); trailrace-equestrian-outfitters (Trailrace Equestrian Outfitters); globo_basis_collection (Globo basis collection - Do not delete); strapping (Bridles & Strapping - Top Brands For All Disciplines)"
"Therapy Boots",4,"kentucky-recuptex-stable-boots; ice-vibe-cold-circulation-tendon-boots; ice-vibe-hock-wraps; rambo-ionic-stable-boots","horse-boots (Horse Boots - All Types); dapple-eq (Dapple EQ); kentucky (Shop Kentucky Horsewear - Boots, Pads, Bonnets, Girths, Bandages & More); globo_basis_collection (Globo basis collection - Do not delete); little-equine-co (Little Equine Co); on-sale (On Sale - Discount On The Best Brands & Gear); horse-rugs (Horse Rugs - All Types)"
"Boys Competition Jacket",4,"animo-isp-boys-competition-jacket; animo-pony-division-idris-boys-jacket; animo-ss20-boys-iale-competition-jacket; animo-iachin-18-boys-competition-jacket","horse-riding-apparel (Competition, Training & Casual - Horse Riding Clothes); dapple-eq (Dapple EQ); on-sale (On Sale - Discount On The Best Brands & Gear); globo_basis_collection (Globo basis collection - Do not delete)"
"Polo Shirt",4,"animo-amalfi-mens-casual-polo-shirt; anky-new-pullover-half-zip; animo-brancio-ladies-polo-top; cavallo-cavalnema-polo-shirt","horse-riding-apparel (Competition, Training & Casual - Horse Riding Clothes); dapple-eq (Dapple EQ); on-sale (On Sale - Discount On The Best Brands & Gear); globo_basis_collection (Globo basis collection - Do not delete); anky (Shop ANKY); little-equine-co (Little Equine Co)"
"Vest",4,"animo-ivo-mens-padded-vest; cavallo-floor-quilted-vest; cavallo-caval-ladies-hybrid-vest; cavallo-cavalnoria-vest","horse-riding-apparel (Competition, Training & Casual - Horse Riding Clothes); dapple-eq (Dapple EQ); animo (Shop Animo Equestrian Gear); on-sale (On Sale - Discount On The Best Brands & Gear); globo_basis_collection (Globo basis collection - Do not delete); little-equine-co (Little Equine Co)"
"Leather Plaited Belt",4,"leather-plaited-belt-navy-and-red; leather-plaited-belt-olive-dark; leather-plaited-belt-olive-light; leather-plaited-belt-black-white","horse-riding-apparel (Competition, Training & Casual - Horse Riding Clothes); hitchley-harrow (Hitchley & Harrow); on-sale (On Sale - Discount On The Best Brands & Gear); globo_basis_collection (Globo basis collection - Do not delete)"
"Hood",4,"deluxe-stretch-zip-hoods-black; fleece-winter-stretch-zip-hoods; summer-stretch-zip-hoods-black; summer-stretch-zip-hoods-white","horse-rugs (Horse Rugs - All Types); diamond-deluxe-horsewear (Diamond Deluxe Horsewear); globo_basis_collection (Globo basis collection - Do not delete)"
"Half Chaps",4,"dyon-comfort-half-chaps; adult-easy-close-half-chaps; childs-zipper-half-chaps; adult-zipper-half-chaps","little-equine-co (Little Equine Co); on-sale (On Sale - Discount On The Best Brands & Gear); dyon (Shop Dy'On European Classic Equestrian Gear); globo_basis_collection (Globo basis collection - Do not delete); tacklet (Tacklet)"
"Books & Magazines",4,"contention-book-1-by-stephen-irwin; resilience-book-5-by-stephen-irwin; providence-book-2-by-stephen-irwin; untouchable-book-4-by-stephen-irwin","horse-books (Books - Fiction & Non Fiction); top-brands (Top Brands); globo_basis_collection (Globo basis collection - Do not delete); pets (Pets - Products For Dogs, Cats, & Other Small Animals)"
"Lead Rope",4,"cavallo-harika-lead-rope-with-panic-hook; kentucky-lead-rope; cavallo-jone-lead-rope; kentucky-plaited-nylon-lead-rope","little-equine-co (Little Equine Co); globo_basis_collection (Globo basis collection - Do not delete); dapple-eq (Dapple EQ); horse-halters (Shop Horse Halters)"
"CLOTHING CLEARANCE",4,"ariat-ascent-short-sleeve-baselayer-navy-ladies; showgirl-sb-trim-show-jacket-navy-childs; wrangler-tee-shirt-brando-long-sleeve-grey-marle-navy-mens; ariat-jacket-lumina-w23-ebony-ladies","horse-riding-apparel (Competition, Training & Casual - Horse Riding Clothes); ascot-saddlery (Ascot Saddlery); base-layers (Shop Horse Riding Base Layers); globo_basis_collection (Globo basis collection - Do not delete); on-sale (On Sale - Discount On The Best Brands & Gear)"
"Bird Potions & Lotions",4,"aristopet-bird-wormer-plus-syrup-50ml; bird-mite-lice-spray-avitrol-250ml; vetafarm-bird-wormout-gel-50ml; vetafarm-probotic-450gm","ascot-saddlery (Ascot Saddlery); globo_basis_collection (Globo basis collection - Do not delete); birds (Shop Birds - Feed, Treats, Accessories, Supplies); pets (Pets - Products For Dogs, Cats, & Other Small Animals)"
"CLOTHING: Clothing Childs",4,"huntington-willow-riding-jacket-navy-childs; tee-shirt-ariat-farm-animal-heather-grey-navy-ls-girls; tee-shirt-ariat-dream-mulberry-ls-girls; polo-ariat-taryn-team-ss-girls","horse-riding-apparel (Competition, Training & Casual - Horse Riding Clothes); ascot-saddlery (Ascot Saddlery); globo_basis_collection (Globo basis collection - Do not delete)"
"shirts",4,"grace-show-shirt; kate-show-shirt; empire-base-layer; classic-short-sleeve-base-layer","horse-riding-apparel (Competition, Training & Casual - Horse Riding Clothes); globo_basis_collection (Globo basis collection - Do not delete); qj-riding-wear (QJ Riding Wear); on-sale (On Sale - Discount On The Best Brands & Gear); base-layers (Shop Horse Riding Base Layers); jnk-collective (JNK Collective)"
"Active Tights",4,"active-tights-grey; active-tights-navy; competition-tights-snow-white; royalty-tights","horse-riding-apparel (Competition, Training & Casual - Horse Riding Clothes); on-sale (On Sale - Discount On The Best Brands & Gear); globo_basis_collection (Globo basis collection - Do not delete); jnk-collective (JNK Collective)"
"Leather Stirrup Straps",4,"kids-stirrup-leathers; bates-classic-blk-webbers-80; prestige-non-stretch-stirrup-straps; academy-stirrup-leathers","globo_basis_collection (Globo basis collection - Do not delete); shire-saddleworld (Shire Saddleworld); prestige (Shop Prestige Saddles, Bridles & Equestrian Gear)"
"Keyring",4,"gold-spur-keyring; 3d-key-ring-silver-horse-head; western-snaffle-keyring; roping-spur-keyring","globo_basis_collection (Globo basis collection - Do not delete); gifts (Horse & Equine Gifts); shire-saddleworld (Shire Saddleworld)"
"Lead Ropes",4,"nungar-suit-yourself-lead-w-cast-bull-clip-14mm; eurohunter-training-rope-23-blue; academy-lead-brass-black-2m; rope-lead-np-snap-turq-mix-1-9m","globo_basis_collection (Globo basis collection - Do not delete); shire-saddleworld (Shire Saddleworld); eurohunter (Shop Eurohunter Equestrian Gear & Accessories); zilco (Shop Zilco Rugs, Horse Boots & Accessories)"
"Stable",4,"eh-stable-mate-w-rake-purple; sabco-bucket-scrub-brush; wall-mounted-rug-rack; dressage-arena-cone-markers-set-of-8","globo_basis_collection (Globo basis collection - Do not delete); shire-saddleworld (Shire Saddleworld); on-sale (On Sale - Discount On The Best Brands & Gear); zilco (Shop Zilco Rugs, Horse Boots & Accessories)"
"Fly mask",4,"horze-supreme-cayman-flymask; b-vertigo-rouge-reflection-fly-mask-pink; woof-wear-fly-mask-w-ears; flyveil-by-design-flyveil-with-cotton-nose","globo_basis_collection (Globo basis collection - Do not delete); shire-saddleworld (Shire Saddleworld)"
"Treats",4,"licorice-treat-250g; positive-pony-cookies-200g; huds-and-toke-pony-pudding; huds-and-toke-little-love-heart-cookies","globo_basis_collection (Globo basis collection - Do not delete); shire-saddleworld (Shire Saddleworld)"
"Breastplate",4,"jeremy-lord-5-point-breastplate; navaho-purple-stone-breastplate-cob; grainge-elite-martingale-breastplate-oak-bark-full; grainge-elite-5-point-breastplate-oak-bark-full","globo_basis_collection (Globo basis collection - Do not delete); shire-saddleworld (Shire Saddleworld); on-sale (On Sale - Discount On The Best Brands & Gear)"
"Horseware",4,"black-crystal-saddle-pad-dressage; black-crystal-saddle-pad-jump; snow-white-crystal-saddle-pad; pearl-pink-crystal-saddle-pad","on-sale (On Sale - Discount On The Best Brands & Gear); globo_basis_collection (Globo basis collection - Do not delete); jnk-collective (JNK Collective)"
"Lunge Line",4,"deep-blue-green-lunge-line; corn-blue-red-lunge-line; deep-grey-deep-red-lunge-line; rose-gold-glamour-lunge-line","globo_basis_collection (Globo basis collection - Do not delete); tacklet (Tacklet)"
"Tail Protector",4,"black-lycra-tail-bag; navy-lycra-tail-bag; royal-blue-lycra-tail-bag; purple-lycra-tail-bag","globo_basis_collection (Globo basis collection - Do not delete); tacklet (Tacklet)"
"Back Protectors",4,"vipa-iii-level-3-body-protector; vipa-level-1-body-protector; vipa-ii-jockey-level-2-body-protector; vipa-ii-level-2-body-protector-drivers-and-passengers-only","globo_basis_collection (Globo basis collection - Do not delete); tacklet (Tacklet)"
"Grackle Bridle",4,"ava-grackle-bridle-with-sheepskin-no-reins; fancy-stitch-padded-grackle-bridle; deluxe-fancy-stitch-padded-grackle-bridle; fancy-stitch-traditional-grackle-bridle","globo_basis_collection (Globo basis collection - Do not delete); tacklet (Tacklet)"
"Medical Supplies",4,"cetrigen-antibacterial-wound-spray; white-healer®; equitex-medicated-poultice-dressing; iodine-10-pvp-solution-500ml","globo_basis_collection (Globo basis collection - Do not delete); tacklet (Tacklet)"
"Tank",4,"essential-tank-navy; essential-tank-black; essential-tank-black-first-edition; essential-tank-navy-first-edition","on-sale (On Sale - Discount On The Best Brands & Gear); globo_basis_collection (Globo basis collection - Do not delete); jnk-collective (JNK Collective)"
"Strapping - Strapping Accessories",3,"kentucky-sheepskin-noseband-cover; kentucky-sheepskin-breastplate-cover; kentucky-stallion-chain","trailrace-equestrian-outfitters (Trailrace Equestrian Outfitters); kentucky (Shop Kentucky Horsewear - Boots, Pads, Bonnets, Girths, Bandages & More); globo_basis_collection (Globo basis collection - Do not delete); strapping (Bridles & Strapping - Top Brands For All Disciplines); horse-halters (Shop Horse Halters)"
"Fetlock boots",3,"anky-new-technical-proficient-boot; kentucky-vegan-sheepskin-young-horse-fetlock-boots; kentucky-young-horse-fetlock-boots-1","horse-boots (Horse Boots - All Types); dapple-eq (Dapple EQ); on-sale (On Sale - Discount On The Best Brands & Gear); globo_basis_collection (Globo basis collection - Do not delete); anky (Shop ANKY)"
"Overreach Boots",3,"kentucky-air-tech-overreach-boots; kentucky-leather-overreach-bell-boots; sheepskin-overreach-boots","horse-boots (Horse Boots - All Types); dapple-eq (Dapple EQ); kentucky (Shop Kentucky Horsewear - Boots, Pads, Bonnets, Girths, Bandages & More); globo_basis_collection (Globo basis collection - Do not delete)"
"Pet Supplements",3,"in-sideout-cat-formula-pre-probiotic-nutraceutical-supplement-for-cats; in-sideout-dog-formula-pre-probiotic-natural-nutraceutical-supplement-for-dogs; pooch-puree-for-both-mature-younger-dogs","horse-health (Horse Health & Nutrition); pets (Pets - Products For Dogs, Cats, & Other Small Animals); eac-animal-care (EAC Animal Care); globo_basis_collection (Globo basis collection - Do not delete); on-sale (On Sale - Discount On The Best Brands & Gear)"
"Boys Show Shirt",3,"animo-ss20-boys-amleto-competition-polo; animo-anice-boys-show-shirt-amaranto-only; animo-arduin-boys-shirt","horse-riding-apparel (Competition, Training & Casual - Horse Riding Clothes); dapple-eq (Dapple EQ); animo (Shop Animo Equestrian Gear); on-sale (On Sale - Discount On The Best Brands & Gear); globo_basis_collection (Globo basis collection - Do not delete)"
"Apparel & Accessories",3,"equiline-steve-childrens-competition-jacket; animo-amburgo-mens-shirt; anky-long-sleeve-polo","horse-riding-apparel (Competition, Training & Casual - Horse Riding Clothes); dapple-eq (Dapple EQ); equiline (Shop Equiline Equestrian Gear); on-sale (On Sale - Discount On The Best Brands & Gear); globo_basis_collection (Globo basis collection - Do not delete); anky (Shop ANKY)"
"Gift Set",3,"horse-themed-cushion-cover-45cm-style-1; horse-themed-cushion-cover-45cm-style-2; horse-themed-cushion-cover-45cm-style-3","horse-jewellery (Horse Jewellery - Equine & Equestrian Themed); living-horse-tales-jewellery-by-monika (Living Horse Tales Jewellery By Monika); globo_basis_collection (Globo basis collection - Do not delete)"
"Fob",3,"stitched-leather-and-stainless-steel-horsehair-keyring-fob-with-charm; stitched-leather-and-stainless-steel-keyring-fob-with-charm; stainless-steel-leather-keyring-fob-with-horse-charm","horse-jewellery (Horse Jewellery - Equine & Equestrian Themed); living-horse-tales-jewellery-by-monika (Living Horse Tales Jewellery By Monika); globo_basis_collection (Globo basis collection - Do not delete); on-sale (On Sale - Discount On The Best Brands & Gear)"
"Rings",3,"ss13-silver-ring-dome-w-decorative-edging; ss15-silver-ring-square-hammered; ss20-silver-stacked-w-h-h-logo-ring","horse-jewellery (Horse Jewellery - Equine & Equestrian Themed); hitchley-harrow (Hitchley & Harrow); globo_basis_collection (Globo basis collection - Do not delete)"
"Tailbag",3,"cotton-ripstop-tailbags; cotton-drill-tailbags; flagcloth-tailbag","horse-rugs (Horse Rugs - All Types); diamond-deluxe-horsewear (Diamond Deluxe Horsewear); globo_basis_collection (Globo basis collection - Do not delete)"
"Gifts",3,"zilco-girth-with-black-fleece; thomas-cook-farm-mug; hairy-pony-candle-gift-series","trailrace-equestrian-outfitters (Trailrace Equestrian Outfitters); zilco (Shop Zilco Rugs, Horse Boots & Accessories); globo_basis_collection (Globo basis collection - Do not delete)"
"Stirrup Leathers",3,"aintree-stitched-stirrup-leather; stirrup-leathers-nappa-leather; premium-stirrup-leathers","horse-riding-apparel (Competition, Training & Casual - Horse Riding Clothes); strapping (Bridles & Strapping - Top Brands For All Disciplines); trailrace-equestrian-outfitters (Trailrace Equestrian Outfitters); globo_basis_collection (Globo basis collection - Do not delete); stirrups (Shop Horse Riding Stirrups & Leathers); tacklet (Tacklet)"
"Saddle Pads & Blankets",3,"cavallo-heather-saddle-pad; cavallo-helaine-saddle-pad; penelope-lyona-saddle-pad","saddle-pads (Saddle Blankets, Pads & Squares); little-equine-co (Little Equine Co); cavallo (Shop Cavallo Products); on-sale (On Sale - Discount On The Best Brands & Gear); globo_basis_collection (Globo basis collection - Do not delete); dapple-eq (Dapple EQ); penelope-leprovost (Shop Penelope Leprovost Equestrian Gear & Apparel)"
"Bird Assorted",3,"bird-harness-leash-aviator-black-small; shellgrit-fine-5kg; shellgrit-medium-5kg","ascot-saddlery (Ascot Saddlery); globo_basis_collection (Globo basis collection - Do not delete); birds (Shop Birds - Feed, Treats, Accessories, Supplies)"
"STABLE: Jumps & Markers",3,"dressage-arena-cones-4-piece; dressage-arena-marker-set-8; dressage-arena-marker-set-4-p-r-v-s","ascot-saddlery (Ascot Saddlery); globo_basis_collection (Globo basis collection - Do not delete)"
"CLOTHING: Oilskins",3,"outback-classic-oilskin-riding-coat-with-hood-brown; outback-oilskin-short-coat-brown; outback-low-rider-oilskin-3-4-length-coat-brown","ascot-saddlery (Ascot Saddlery); globo_basis_collection (Globo basis collection - Do not delete); horse-riding-apparel (Competition, Training & Casual - Horse Riding Clothes); pets (Pets - Products For Dogs, Cats, & Other Small Animals); on-sale (On Sale - Discount On The Best Brands & Gear)"
"Ankle Boots",3,"secchiari-classic-ankle-boots-with-laces; secchiari-grained-leather-classic-ankle-boots-with-laces; secchiari-classic-zip-ankle-boots-with-elastic","dapple-eq (Dapple EQ); globo_basis_collection (Globo basis collection - Do not delete)"
"Outerwear",3,"adaptable-jacket; elite-jacket-limited-edition; lightweight-waterproof-long-jacket-black","horse-riding-apparel (Competition, Training & Casual - Horse Riding Clothes); on-sale (On Sale - Discount On The Best Brands & Gear); globo_basis_collection (Globo basis collection - Do not delete); jnk-collective (JNK Collective)"
"Hay Net",3,"horze-heavy-duty-haynet-black; deluxe-jute-hayfeeder-bag; eureka-hay-net-bold-34","globo_basis_collection (Globo basis collection - Do not delete); shire-saddleworld (Shire Saddleworld)"
"Gear Bag",3,"ariat-team-tall-boot-bag-navy; zilco-bling-bridle-bag; pvc-gear-bag-medium-black-grey","ariat (Shop & Buy Ariat Clothing & Footwear); globo_basis_collection (Globo basis collection - Do not delete); shire-saddleworld (Shire Saddleworld); zilco (Shop Zilco Rugs, Horse Boots & Accessories); on-sale (On Sale - Discount On The Best Brands & Gear)"
"Cotton Rugs",3,"eurohunter-grand-national-light-ii-combo; eurohunter-grand-national-light-ii-rug; eurohunter-cool-air-combo","globo_basis_collection (Globo basis collection - Do not delete); eurohunter (Shop Eurohunter Equestrian Gear & Accessories); shire-saddleworld (Shire Saddleworld); on-sale (On Sale - Discount On The Best Brands & Gear)"
"Chaps",3,"eurohunter-leather-chaps; jodz-airmesh-chapettes; eurohunter-clarino-chapettes","on-sale (On Sale - Discount On The Best Brands & Gear); globo_basis_collection (Globo basis collection - Do not delete); eurohunter (Shop Eurohunter Equestrian Gear & Accessories); shire-saddleworld (Shire Saddleworld); zilco (Shop Zilco Rugs, Horse Boots & Accessories)"
"Bell boots",3,"horze-overreach-boots-no-turn; horze-probell-boots; grainge-golden-fleece-bell-boot","globo_basis_collection (Globo basis collection - Do not delete); shire-saddleworld (Shire Saddleworld)"
"Rug Accessories",3,"eurohunter-grand-national-light-ii-hood; eurohunter-padded-taffetta-chest-bib; comforce-shoulder-rug-black","globo_basis_collection (Globo basis collection - Do not delete); eurohunter (Shop Eurohunter Equestrian Gear & Accessories); shire-saddleworld (Shire Saddleworld)"
"Headpiece",3,"anatomic-monocrown-headpiece; poll-protector-mr-feel-warm; anatomic-broad-headpiece-double-bridle","globo_basis_collection (Globo basis collection - Do not delete); tacklet (Tacklet)"
"Studs",3,"studs-for-wet-deep-boggy-ground-set-of-4; studs-for-soft-deep-ground-set-of-4; studs-for-soft-ground-set-of-4","globo_basis_collection (Globo basis collection - Do not delete); tacklet (Tacklet)"
"Bridle Strapping",3,"throat-lash-flat-strap; cheek-straps-flat; cheek-pieces-with-buckle-fastenings","globo_basis_collection (Globo basis collection - Do not delete); tacklet (Tacklet)"
"Donation",3,"rspca-victoria; kindness-contribution; donation","eac-animal-care (EAC Animal Care); globo_basis_collection (Globo basis collection - Do not delete)"
"Boots - Boot Accessories",2,"ariat-team-tall-boot-bag; tucci-boot-cream","footwear (Horse Riding Boots & Footwear, Trainers, Workers); trailrace-equestrian-outfitters (Trailrace Equestrian Outfitters); luggage (Luggage For The Horse Rider); ariat (Shop & Buy Ariat Clothing & Footwear); globo_basis_collection (Globo basis collection - Do not delete)"
"Girls Shirt",2,"animo-bianca-girls-competition-shirt; animo-biky-girls-competition-shirt","horse-riding-apparel (Competition, Training & Casual - Horse Riding Clothes); dapple-eq (Dapple EQ); on-sale (On Sale - Discount On The Best Brands & Gear); globo_basis_collection (Globo basis collection - Do not delete)"
"Mens Competition Jacket",2,"animo-ikko-mens-competition-jacket; animo-ss20-mens-isla-competition-jacket","horse-riding-apparel (Competition, Training & Casual - Horse Riding Clothes); dapple-eq (Dapple EQ); on-sale (On Sale - Discount On The Best Brands & Gear); globo_basis_collection (Globo basis collection - Do not delete); animo (Shop Animo Equestrian Gear)"
"TShirt",2,"dapple-tees; animo-fibi-ladies-t-shirt","horse-riding-apparel (Competition, Training & Casual - Horse Riding Clothes); dapple-eq (Dapple EQ); globo_basis_collection (Globo basis collection - Do not delete); on-sale (On Sale - Discount On The Best Brands & Gear)"
"Hatband",2,"horsehair-braided-hatband-with-tassles-and-adjustable-waxed-cord-slider; thin-horsehair-or-cattle-braided-hatband-with-adjustable-sliding-tassle","horse-riding-apparel (Competition, Training & Casual - Horse Riding Clothes); horse-jewellery (Horse Jewellery - Equine & Equestrian Themed); living-horse-tales-jewellery-by-monika (Living Horse Tales Jewellery By Monika); globo_basis_collection (Globo basis collection - Do not delete); on-sale (On Sale - Discount On The Best Brands & Gear)"
"Locket",2,"stainless-steel-memory-locket-with-engraved-disc; paw-fur-memorial-keepsake-locket","horse-jewellery (Horse Jewellery - Equine & Equestrian Themed); living-horse-tales-jewellery-by-monika (Living Horse Tales Jewellery By Monika); globo_basis_collection (Globo basis collection - Do not delete)"
"Charm Bead",2,"sterling-silver-heart-horseshoe-bead; sterling-silver-horseshoe-beads","horse-jewellery (Horse Jewellery - Equine & Equestrian Themed); living-horse-tales-jewellery-by-monika (Living Horse Tales Jewellery By Monika); globo_basis_collection (Globo basis collection - Do not delete)"
"Log Book Cover",2,"log-book-cover-cognac; log-book-cover-tan","horse-books (Books - Fiction & Non Fiction); hitchley-harrow (Hitchley & Harrow); globo_basis_collection (Globo basis collection - Do not delete)"
"Sale",2,"deluxe-quilted-wool-rug; cotton-dril-rug-53","horse-rugs (Horse Rugs - All Types); diamond-deluxe-horsewear (Diamond Deluxe Horsewear); globo_basis_collection (Globo basis collection - Do not delete)"
"Ladies Top",2,"cavallo-dora-sleeveless-top; cavallo-fleur-sleeveless-polo-in-blue-violet","horse-riding-apparel (Competition, Training & Casual - Horse Riding Clothes); little-equine-co (Little Equine Co); cavallo (Shop Cavallo Products); on-sale (On Sale - Discount On The Best Brands & Gear); globo_basis_collection (Globo basis collection - Do not delete)"
"Riding Jacket",2,"cavallo-ganim-short-tail-coat; cavallo-ganim-short-tail-coat-with-nailheads-on-collar","horse-riding-apparel (Competition, Training & Casual - Horse Riding Clothes); little-equine-co (Little Equine Co); globo_basis_collection (Globo basis collection - Do not delete)"
